id,url,account,text,date,retweet,favorite,mentioned,hashtags,geotags,keyword
"997457538546327553","https://twitter.com/PBRNewYork/status/997457538546327553","PBRNewYork","JUCO Wire: Only 3 teams remain in the NJCAA D1 Eastern District for a shot at the World Series in Grand Junction, CO. Two of those representing the Empire State. @USCSumterBSE (1-0), @MC_MustangsBASE (1-0), @ASA_ Sports (1-1). Harford CC (0-2) was eliminated. @PBR_JUCO", "20180518","4","4","@USCSumterBSE @MC_MustangsBASE @ASA_ @PBR_JUCO","", "", "Empire Sports"
"997453507979612164","https://twitter.com/Morgan_Hughes/status/997453507979612164","Morgan_Hughes","Precourt Sports Ventures is a dumpster fire, and I hope @Allstate , @HomeDepot , @Heineken , @Audi , @CocaColaCo , @Target , @SeatGeek , @TAGHeuer all pay attention to how Dave Greeley talks about the corporate partners of @MLS . Your empire is crumbling, @thesoccerdon . #SaveTheCrew https:// twitter.com/knaas/status/9 97445366177026048 …", "20180518","24","95","@Allstate @HomeDepot @Heineken @Audi @CocaColaCo @Target @SeatGeek @TAGHeuer @MLS @thesoccerdon","#SaveTheCrew", "", "Empire Sports"
"997452714404728832","https://twitter.com/ElevateYGrind/status/997452714404728832","ElevateYGrind","IMPACT! #EYG #ElevateYourGrind #sports #lifestyle #brand #global #business #entrepreneur #god #yoga #apparel #gear #teamEYG #football #basketball #community #models #training #track #manifest #culture #trend #empire #fashion #fitlife #run #culturecatalyst https:// ift.tt/2rScMFz pic.twitter.com/JpZfSYMj3y", "20180518","0","3","","#EYG #ElevateYourGrind #sports #lifestyle #brand #global #business #entrepreneur #god #yoga #apparel #gear #teamEYG #football #basketball #community #models #training #track #manifest #culture #trend #empire #fashion #fitlife #run #culturecatalyst", "", "Empire Sports"
"997445390051004416","https://twitter.com/Darrenammo86/status/997445390051004416","Darrenammo86","Bare in mind you’re talking about a country that invented half the worlds sports , created the industrial revolution, antibiotics, the internet, land of Shakespeare, Isaac Newton and the country that held the largest empire in human history. Talentless? Speak for yourself....", "20180518","0","0","","", "", "Empire Sports"
"997436872635936774","https://twitter.com/traumen351/status/997436872635936774","traumen351","Arsenal is only a collateral to obtain loans for Kroenke's sports empire in America. He'll sell when he's done. At what state? My guess is perpetual mediocrity", "20180518","0","1","","", "", "Empire Sports"
"997425758485262336","https://twitter.com/superchickendx/status/997425758485262336","superchickendx","Episode 39: The regicide of Warz Gill, an event that will no doubt destabilise the politics of the galaxy even beyond what the Zangyack empire controls, has managed to make the front page of Space Sports Extra. Must be a slow news day! Let's have a going-to-school episode. pic.twitter.com/vKTAfyouAc", "20180518","0","3","","", "", "Empire Sports"
"997421172789862401","https://twitter.com/FaerieRegina/status/997421172789862401","FaerieRegina","#ideamines_imgsf #empire _of_cricket6 #history_of_cricket #games #sports http:// bit.ly/2i5UriJ #history_of_ sport #sharing_knowledge", "20180518","0","0","","#ideamines_imgsf #empire #history_of_cricket #games #sports #history_of_ #sharing_knowledge", "", "Empire Sports"
"997360841732317184","https://twitter.com/Return2UrSource/status/997360841732317184","Return2UrSource","#ideamines_imgsf #empire _of_cricket6 #history_of_cricket #games #sports http:// bit.ly/2i5UriJ #history_of_ sport #sharing_knowledge", "20180518","0","0","","#ideamines_imgsf #empire #history_of_cricket #games #sports #history_of_ #sharing_knowledge", "", "Empire Sports"
"997330234352521216","https://twitter.com/lanatxt/status/997330234352521216","lanatxt","Every day I think the Empire can't get any more cruel, and every day I'm proven wrong. They prey on the weak and vulnerable as if snuffing out their lives is a sport to them... I can't sit quietly and accept this!", "20180518","0","0","","", "", "Empire Sports"
"997318022963585025","https://twitter.com/saulomiguelds/status/997318022963585025","saulomiguelds","EMPIRE SPORT .  O Melhor para sua Vida . https://www. instagram.com/p/Bi51lmtltUy/ ?utm_source=ig_twitter_share&igshid=1fchzpwdhc6kq …", "20180517","0","0","","", "", "Empire Sports"
"997296047574716416","https://twitter.com/_EMPIRE_SPORTS_/status/997296047574716416","_EMPIRE_SPORTS_","I use to wait after games to just see this man… https://www. instagram.com/p/Bi5rlhbFBIr/ ?utm_source=ig_twitter_share&igshid=1nx1q96wpkoov …", "20180517","0","0","","", "", "Empire Sports"
"997278230414594050","https://twitter.com/scooochie/status/997278230414594050","scooochie","Follow our new Giants twitter for Empire Sports Media. All our Giants coverage is here. @nygiantsesm #NYGiants #giants #giantspride", "20180517","0","3","@nygiantsesm","#NYGiants #giants #giantspride", "", "Empire Sports"
"997247822708723713","https://twitter.com/bebe_linda144/status/997247822708723713","bebe_linda144","( R$120,00 ) 212 Men 212 Sex Men 212 Sex Fem 212 Vip Ferrari Black Ferrari Red One milion ) ( Empire Empire Sport R$145,00 )", "20180517","0","0","","", "", "Empire Sports"
"997233687598071809","https://twitter.com/thponders/status/997233687598071809","thponders","So this weeks episode is a sports mockumentary in the style of @99piorg and @30for30 about a ballgame that took place in Veracruz from the perspective of people living in the Aztec Empire . It's a bit of a trip, but boy is it fun. https:// twitter.com/accessionfm/st atus/997229192537411584 …", "20180517","0","2","@99piorg @30for30","", "", "Empire Sports"
"997211097810784256","https://twitter.com/ElevateYGrind/status/997211097810784256","ElevateYGrind","I Love My Mom #EYG #ElevateYourGrind #sports #lifestyle #brand #global #business #entrepreneur #god #yoga #apparel #gear #teamEYG #football #basketball #community #models #training #track #manifest #culture #trend #empire #fashion #fitlife #run #culturec … https:// ift.tt/2wSyWfK pic.twitter.com/75KdWUoqyz", "20180517","0","4","","#EYG #ElevateYourGrind #sports #lifestyle #brand #global #business #entrepreneur #god #yoga #apparel #gear #teamEYG #football #basketball #community #models #training #track #manifest #culture #trend #empire #fashion #fitlife #run #culturec", "", "Empire Sports"
"997202055046553601","https://twitter.com/lanatxt/status/997202055046553601","lanatxt","Every day I think the Empire can't get any more cruel, and every day I'm proven wrong. They prey on the weak and vulnerable as if snuffing out their lives is a sport to them... I can't sit quietly and accept this!", "20180517","0","0","","", "", "Empire Sports"
"997181103663341568","https://twitter.com/CLEsportsfan_/status/997181103663341568","CLEsportsfan_","Luckiest team in sports #Rockets in 7", "20180517","0","1","","#Rockets", "", "Empire Sports"
"997164301591789568","https://twitter.com/arpita201784/status/997164301591789568","arpita201784","New post (Skechers Sport Women's Empire Inside Look Fashion Sneaker) has been published on Darren Blogs - http:// darrenblogs.com/blog/skechers- sport-womens-empire-inside-look-fashion-sneaker/ … pic.twitter.com/wU52LLG8nH", "20180517","0","0","","", "", "Empire Sports"
"997164294251855872","https://twitter.com/Jessica072014/status/997164294251855872","Jessica072014","New post (Skechers Sport Women's Empire Inside Look Fashion Sneaker) has been published on Darren Blogs - http:// darrenblogs.com/blog/skechers- sport-womens-empire-inside-look-fashion-sneaker/ … pic.twitter.com/gUah1R8xKP", "20180517","0","0","","", "", "Empire Sports"
"997132637843218434","https://twitter.com/HedrichPierre/status/997132637843218434","HedrichPierre","Arnaud Lagardere Papa, j'ai rétréci l' empire #une de @libe sur le désengagement des #medias et du sport de l'héritier #presse #radio #tv #kiosque pic.twitter.com/ZfCDaBbNHG", "20180517","2","3","@libe","#une #medias #presse #radio #tv #kiosque", "", "Empire Sports"
"997126766815731712","https://twitter.com/Spursian_Empire/status/997126766815731712","Spursian_Empire","BLEACHER REPORT SUSPENDED BARSTOOL SPORTS NEXT PLS pic.twitter.com/y2zIrmh0Oz", "20180517","8","29","","", "", "Empire Sports"
"997078597947965442","https://twitter.com/_EMPIRE_SPORTS_/status/997078597947965442","_EMPIRE_SPORTS_","That 1-2 punch combination courtesy of the… https://www. instagram.com/p/Bi4IPzoBh-A/ ?utm_source=ig_twitter_share&igshid=r299oce96arc …", "20180517","0","0","","", "", "Empire Sports"
"997071526615814144","https://twitter.com/mattmbr/status/997071526615814144","mattmbr","Go to @FoleysNY best sports bar in NYC. It’s right by the Empire State Building", "20180517","0","2","@FoleysNY","", "", "Empire Sports"
"997070126489849858","https://twitter.com/_EMPIRE_SPORTS_/status/997070126489849858","_EMPIRE_SPORTS_","Boom!!! We are EMPIRE !!! @donovansolano17 … https://www. instagram.com/p/Bi4Efw9lMDc/ ?utm_source=ig_twitter_share&igshid=o83mfjpa2p8l …", "20180517","0","0","@donovansolano17","", "", "Empire Sports"
"997058891522428928","https://twitter.com/FaerieRegina/status/997058891522428928","FaerieRegina","#ideamines_imgsf #empire _of_cricket6 #history_of_cricket #games #sports http:// bit.ly/2i5UriJ #history_of_ sport #sharing_knowledge", "20180517","0","0","","#ideamines_imgsf #empire #history_of_cricket #games #sports #history_of_ #sharing_knowledge", "", "Empire Sports"
"997049014150483969","https://twitter.com/LlandoveryColl/status/997049014150483969","LlandoveryColl","We are delighted at the news that Old Llandoverian, David Gravell, has been awarded the British Empire Medal for his services to charity, sport and education. This is a well deserved honour for this distinguished gentleman. Further details here: https://www. walesonline.co.uk/news/world-new s/full-list-welsh-recipients-sam-14093605 …", "20180517","5","11","","", "", "Empire Sports"
"997047051224604673","https://twitter.com/shelsleywalsh/status/997047051224604673","shelsleywalsh","The @BBCSport made their first ever outside sports broadcast here at Shelsley in 1932. The day was broadcast to the world on the National and Empire Service and heard in Australia. Earl Howe was fastest on the day in his Bugatti in 44 seconds. #shelsleywalsh #shelsleyhistory pic.twitter.com/y1s8U1YKrr", "20180517","12","22","@BBCSport","#shelsleywalsh #shelsleyhistory", "", "Empire Sports"
"997041508288114689","https://twitter.com/TheDanHough/status/997041508288114689","TheDanHough","Viewing get complex. Rugby league (a sport I follow) sold its soul to the Murdoch empire . Just hope that Murdoch doesn't turn its back on it. The sport as we know it dead in the water if he does", "20180517","0","0","","", "", "Empire Sports"
"997028119411294209","https://twitter.com/Megastaraamir/status/997028119411294209","Megastaraamir","Lagaan... Empire Mag...100 greatest foreign movies...BBC...top 15 sports movie. But Khoonitards: Chormax,Bhaiofficejodhpur & Savan Rox", "20180517","1","1","","", "", "Empire Sports"
"997020657245356033","https://twitter.com/lanatxt/status/997020657245356033","lanatxt","Every day I think the Empire can't get any more cruel, and every day I'm proven wrong. They prey on the weak and vulnerable as if snuffing out their lives is a sport to them... I can't sit quietly and accept this!", "20180517","0","0","","", "", "Empire Sports"
"996998059501506560","https://twitter.com/Return2UrSource/status/996998059501506560","Return2UrSource","#ideamines_imgsf #empire _of_cricket6 #history_of_cricket #games #sports http:// bit.ly/2i5UriJ #history_of_ sport #sharing_knowledge", "20180517","0","0","","#ideamines_imgsf #empire #history_of_cricket #games #sports #history_of_ #sharing_knowledge", "", "Empire Sports"
"996923737818783745","https://twitter.com/sports_broad/status/996923737818783745","sports_broad","#Empire #Hustle &FlowScenes", "20180516","0","0","","#Empire #Hustle", "", "Empire Sports"
"996919483653541888","https://twitter.com/DarrylMason/status/996919483653541888","DarrylMason","James Murdoch bails out on the crumbling Murdoch Family media empire . Fox News might still be profitable, but UK papers are dying hard, Australian papers are mostly dead assets, Sky News and Fox Sports down hundreds of million in value. Still a few bucks in real estate ads. Maybe https:// twitter.com/davidfolkenfli k/status/996769237590044672 …", "20180516","0","0","","", "", "Empire Sports"
"996916352395902976","https://twitter.com/CrystalEmm91/status/996916352395902976","CrystalEmm91","Signing autographs for the @fillactive_fitspirit in my chill @yosox . Inspire the young ladies to believe that they are strong, hard work and powerful to set goals in sports . A woman with a vision empowers empire of women to do more, see more and be more. I have a vision. pic.twitter.com/92DxFJIFNX", "20180516","1","19","@fillactive_fitspirit @yosox","", "", "Empire Sports"
"996905740257415171","https://twitter.com/djjoerosso/status/996905740257415171","djjoerosso","Sports Ball 2018 – drinking music at Empire Coventry https://www. facebook.com/joe.calladine. 3/posts/10214766389620952 …", "20180516","0","0","","", "", "Empire Sports"
"996889954981642241","https://twitter.com/Lightning_JL/status/996889954981642241","Lightning_JL","Speaking of stock, I just put a Tweet out on a heavy buy recommendation on CKush & Empire Sports & Entertainment. Boxing stocks are SOLID investments!!!!", "20180516","0","1","","", "", "Empire Sports"
"996889500621115393","https://twitter.com/Lightning_JL/status/996889500621115393","Lightning_JL","I’m not sure but I heard Blue Horseshoe loves Anikot Steel and CKush & The Empire Sports & Entertainment! #BoxingStocks", "20180516","0","0","","#BoxingStocks", "", "Empire Sports"
"996827013284552706","https://twitter.com/libe/status/996827013284552706","libe","A la une de «Libé» jeudi 17 mai Arnaud Lagardère : Papa, j’ai rétréci l’ empire En se désengageant des médias et du sport , l'héritier accélère le dépeçage du groupe fondé par son père. Récit de quinze ans de gestion tout en errements et en dilettantisme. http://www. liberation.fr/liseuse/public ation/17-05-2018/1/ … pic.twitter.com/9TfdOfMY2V", "20180516","59","49","","", "", "Empire Sports"
"996824639027458049","https://twitter.com/lanatxt/status/996824639027458049","lanatxt","Every day I think the Empire can't get any more cruel, and every day I'm proven wrong. They prey on the weak and vulnerable as if snuffing out their lives is a sport to them... I can't sit quietly and accept this!", "20180516","0","0","","", "", "Empire Sports"
"996804261404033024","https://twitter.com/Spursian_Empire/status/996804261404033024","Spursian_Empire","Barstool Sports getting destroyed again for doing something douchey is something I live for https:// twitter.com/meatymcsorley/ status/996437656845238272 …", "20180516","3","23","","", "", "Empire Sports"
"996797367662796801","https://twitter.com/InlandEmpireBCA/status/996797367662796801","InlandEmpireBCA","The Inland Empire Baseball Coaches Association Senior All-Star Game is set! Friday June 8th at San Manuel Stadium, 7:00pm. IEBCA Member Coaches...be sure to get your nominations in! @Inland_ Sports @SportswithPep @GeoffreyGorham pic.twitter.com/ABdgXMDsyH", "20180516","12","22","@Inland_ @SportswithPep @GeoffreyGorham","", "", "Empire Sports"
"996795752092520449","https://twitter.com/Naphulasguns/status/996795752092520449","Naphulasguns","Mhm, just keep our empire out of you black flames path, though humans are but ants to us, they do make good blood sports at time.", "20180516","0","0","","", "", "Empire Sports"
"996778746156912645","https://twitter.com/News_Mill/status/996778746156912645","News_Mill","Empire Resorts to Implement #Sports Betting https:// goo.gl/fb/USPDWh #sportsgaming #gaming #sportsbetting", "20180516","0","0","","#Sports #sportsgaming #gaming #sportsbetting", "", "Empire Sports"
"996770951697256448","https://twitter.com/genlivecast/status/996770951697256448","genlivecast","At the 1954 British Empire Games in Vancouver, Major Emmanuel Ifeajuna competed wearing only his left shoe yet jumped 6'8 in (2.03 m) to win gold medal which made him the first Black African ever to win at a major international sports competition. Pic: http:// oldnaija.com pic.twitter.com/zjv02Ept1U", "20180516","2","1","","", "", "Empire Sports"
"996731069171929089","https://twitter.com/toprank_sport/status/996731069171929089","toprank_sport","Fully restocked on the @EmpireProTape Range, including the brand new BBBoC approved tape! Best tape in the fight business Shop now, in store of online http://www. topranksport.co.uk . . . . . #empire #empireprotape #tapeofchampions #fightnight #topranksport #BBBoC pic.twitter.com/bRm9kzyduQ", "20180516","4","7","@EmpireProTape","#empire #empireprotape #tapeofchampions #fightnight #topranksport #BBBoC", "", "Empire Sports"
"996729150563024896","https://twitter.com/OnSidelines/status/996729150563024896","OnSidelines","NYC v LI... All Set for The 23rd Annual Empire Challenge on Friday, June 15, at Hofstra! Let's Go for the Three Peat! You can always count on Newsday for High School Sports coverage! Thanks! https://www. newsday.com/sports/high-sc hool/football/empire-challenge-2018-long-island-roster-1.18557084#user=56bc011e18ff43a12491b4b7&utm_source=newsletter&utm_medium=email&utm_campaign=Sports …", "20180516","0","1","","#user", "", "Empire Sports"
"996712242312724480","https://twitter.com/vshsundar/status/996712242312724480","vshsundar","Karnataka Premier League. 112 to score. The Flower's confidence. The Empire Gov. Uncle is with us.105 already scored. Star sports media( Times Now, Republic, News18,zee news& co. With flower. Just 7 cute little boys100×7= 700crs only.", "20180516","0","0","","", "", "Empire Sports"
"996696514343985152","https://twitter.com/dan_kilvington/status/996696514343985152","dan_kilvington","Excellent first panel with lively discussion around mediatized representations, national identity, the building of heroes, mega-events, sport and empire #lborosportmedia @lboroCRCC @jackstblack @sportinaus @michael_silk pic.twitter.com/zhCWdn98bB", "20180516","2","4","@lboroCRCC @jackstblack @sportinaus @michael_silk","#lborosportmedia", "", "Empire Sports"
"996696408433549312","https://twitter.com/FaerieRegina/status/996696408433549312","FaerieRegina","#ideamines_imgsf #empire _of_cricket6 #history_of_cricket #games #sports http:// bit.ly/2i5UriJ #history_of_ sport #sharing_knowledge", "20180516","0","0","","#ideamines_imgsf #empire #history_of_cricket #games #sports #history_of_ #sharing_knowledge", "", "Empire Sports"
"996687933326405632","https://twitter.com/RobbySabo/status/996687933326405632","RobbySabo","The great Gigi Fernandez of the New York Empire joins Schwartz on Sports . https:// soundcloud.com/elite-sports-ny", "20180516","0","0","","", "", "Empire Sports"
"996645476509323265","https://twitter.com/emm_ell_dee/status/996645476509323265","emm_ell_dee","Who bought Fox? The Walt Disney Co. has set a $52.4 billion, all-stock deal to acquire 20th Century Fox and other entertainment and sports assets from Rupert Murdoch's empire . http:// variety.com/2017/biz/news/ disney-fox-merger-deal-52-4-billion-merger-1202631242/ … pic.twitter.com/FZ905mHVRD", "20180516","0","0","","", "", "Empire Sports"
"996635723817250817","https://twitter.com/Return2UrSource/status/996635723817250817","Return2UrSource","#ideamines_imgsf #empire _of_cricket6 #history_of_cricket #games #sports http:// bit.ly/2i5UriJ #history_of_ sport #sharing_knowledge", "20180516","0","0","","#ideamines_imgsf #empire #history_of_cricket #games #sports #history_of_ #sharing_knowledge", "", "Empire Sports"
"996620510841790464","https://twitter.com/lanatxt/status/996620510841790464","lanatxt","Every day I think the Empire can't get any more cruel, and every day I'm proven wrong. They prey on the weak and vulnerable as if snuffing out their lives is a sport to them... I can't sit quietly and accept this!", "20180516","0","0","","", "", "Empire Sports"
"996595142793539584","https://twitter.com/DerrikTrombley/status/996595142793539584","DerrikTrombley","ESPN is trying hard to promote the SCOTUS decision on legalised sports betting as a really good in order to promote their failing media empire . Enjoy you pieces of sh*t.", "20180515","0","0","","", "", "Empire Sports"
"996593664544690177","https://twitter.com/bmoore1294/status/996593664544690177","bmoore1294","Yeah but the emotional tie is how Jordan transcended sports and became THE greatest athlete. He was SO GOOD that he broke out of the NBA and started making merchandise and got movie roles and all of the other BS. Granted, Lebron’s done that too but MJ built an empire from scratch", "20180515","0","0","","", "", "Empire Sports"
"996584058485272576","https://twitter.com/Slots/status/996584058485272576","Slots","Legalized sports betting at local OTBs and Empire City Casino could be in play: Tax Watch. https:// lohud.us/2ILEpcY", "20180515","0","1","","", "", "Empire Sports"
"996576761058967552","https://twitter.com/Slots/status/996576761058967552","Slots","Legalized sports betting in play in Yonkers Empire casino, OTB parlors. https:// lohud.us/2ILEpcY", "20180515","0","0","","", "", "Empire Sports"
"996575165487239168","https://twitter.com/ryanhide/status/996575165487239168","ryanhide","The only PED scandal that ever deserved public scorn was Lance Armstrong because the guy built a business empire around the fairy tale story of overcoming cancer to become a champion in an endurance centric sport .", "20180515","0","0","","", "", "Empire Sports"
"996571148170268673","https://twitter.com/pancakeparadox/status/996571148170268673","pancakeparadox","and, depending on from what empire you hail, war and sport are indistinguishable concepts to begin with. I mean, I'm sure the Ionians, Macedonians, and Persians were never particularly threatened by Troy, and yet it burns all the same. And burns, and burns, and burns.", "20180515","0","1","","", "", "Empire Sports"
"996547278595768320","https://twitter.com/lohud/status/996547278595768320","lohud","Legalized sports betting at local OTBs and Empire City Casino could be in play: Tax Watch https:// lohud.us/2wMa8WQ pic.twitter.com/AORxhRbsAc", "20180515","0","1","","", "", "Empire Sports"
"996516662387109889","https://twitter.com/kohuje/status/996516662387109889","kohuje","continue le sport lâche pas! si c'est récent vrm fait tt pour pas que ça empire , si tu veut venir dm en parler j'suis là, cherches la raison du pq ca a commencer & pq t'as peur, + tu sors - tu les as dnc essaie qd mm 1 premiere fois, 1 promenade avc ta famille au parc par exemple", "20180515","0","1","","", "", "Empire Sports"
"996512097742843904","https://twitter.com/seinfeld_fan/status/996512097742843904","seinfeld_fan","Empire Resorts Sees Opportunity in Supreme Court Decision on Sports Betting https:// ift.tt/2jXz6t3", "20180515","0","0","","", "", "Empire Sports"
"996503482969489408","https://twitter.com/EmpireHyundaiMA/status/996503482969489408","EmpireHyundaiMA","Who's excited for a Flash Sale? Lease a new 2018 Hyundai Santa Fe Sport for just $57/week at Empire Hyundai. Call or visit us for more info! #Hyundai #SantaFeSport #sale #SUV #crossover https:// bit.ly/2Gm9n6a pic.twitter.com/HmEXWJGnFA", "20180515","0","0","","#Hyundai #SantaFeSport #sale #SUV #crossover", "", "Empire Sports"
"996499822889918464","https://twitter.com/lanatxt/status/996499822889918464","lanatxt","Every day I think the Empire can't get any more cruel, and every day I'm proven wrong. They prey on the weak and vulnerable as if snuffing out their lives is a sport to them... I can't sit quietly and accept this!", "20180515","0","0","","", "", "Empire Sports"
"996460169298169856","https://twitter.com/KennyPolcari/status/996460169298169856","KennyPolcari","I am not so sure that legalizing sports betting will lead to the downfall of the empire ....Drugs...ok......but sports betting not so sure...", "20180515","0","1","","", "", "Empire Sports"
"996449149812961282","https://twitter.com/BWSportsWire/status/996449149812961282","BWSportsWire","Empire Resorts Sees Opportunity in Supreme Court Decision on Sports Betting https://www. businesswire.com/news/home/2018 0515006079/en/Empire-Resorts-Sees-Opportunity-Supreme-Court-Decision#.WvsfLk9eQ8k.twitter …", "20180515","0","1","","#", "", "Empire Sports"
"996408608693936129","https://twitter.com/STSoaring/status/996408608693936129","STSoaring","DICK’S: Fostering a Lifetime of Sports #STSoaring Supported Growth of Storied Company Means Hundreds of New Jobs for the Region! | Empire State Development https:// esd.ny.gov/esd-media-cent er/success-stories/dick%E2%80%99s-fostering-lifetime-sports#.Wvr5I3Gcibg.twitter …", "20180515","1","2","","#STSoaring #", "", "Empire Sports"
"996407378508689411","https://twitter.com/newsinvesting/status/996407378508689411","newsinvesting","Empire Resorts updates on sports betting - https:// invst.ly/7gib8", "20180515","0","0","","", "", "Empire Sports"
"996404906100756481","https://twitter.com/InvestingStockz/status/996404906100756481","InvestingStockz","Empire Resorts updates on sports betting - https:// invst.ly/7gib8", "20180515","0","0","","", "", "Empire Sports"
"996403382574243840","https://twitter.com/MarketCurrents/status/996403382574243840","MarketCurrents","Empire Resorts updates on sports betting https:// seekingalpha.com/news/3356821-e mpire-resorts-updates-sports-betting?source=feed_f … $ NYNY", "20180515","0","0","","", "", "Empire Sports"
