id,url,account,text,date,retweet,favorite,mentioned,hashtags,geotags,keyword
"997657694692630528","https://twitter.com/phimonic/status/997657694692630528","phimonic","https://www. youtube.com/watch?v=Cc6as0 CYVUk … i mean you got to congratulate 'em for actually pulling this off ,.. billion dollar scheme :D", "20180518","1","1","","", "", "Disclose TV"
"997656887779905536","https://twitter.com/phimonic/status/997656887779905536","phimonic","http:// alien-ufo-sightings.com/2017/08/nasa-m ars-hoax-rover-is-on-devon-island-canada-you-decide/ … that video was awesome ,.. i wonder why it's gone", "20180518","1","1","","", "", "Disclose TV"
"997631643157450752","https://twitter.com/ElPrez216/status/997631643157450752","ElPrez216","I can tell you one thing att reps dont disclose everything that changes when u change plans I got duped droppin uverse tv gettin durectv now and this streamin service is going on my home data usage amounts and I cant get any assistance from @ATTCares", "20180518","0","0","@ATTCares","", "", "Disclose TV"
"997626120680984576","https://twitter.com/arcturusii/status/997626120680984576","arcturusii","This Ancient Shark Is 500 Years Old And Was Born Before Shakespeare https://www. disclose.tv/ancient-shark- said-to-be-worlds-oldest-living-vertebrate-at-512-years-old-316534 … via @DiscloseTV #nature", "20180518","0","0","@DiscloseTV","#nature", "", "Disclose TV"
"997614257201139712","https://twitter.com/D_Williams101/status/997614257201139712","D_Williams101","Galactus is not from a parallel world... same universe", "20180518","0","0","","", "", "Disclose TV"
"997602982073118722","https://twitter.com/Elblond23/status/997602982073118722","Elblond23","Retweeted http:// Disclose.tv ( @DiscloseTV ): Is this a creature from a parallel world? https://www. disclose.tv/the-gate-has-o pened-this-insect-seems-to-be-from-another-dimension-315645 … https://www. disclose.tv/the-gate-has-o pened-this-insect-seems-to-be-from-another-dimension-315645 …", "20180518","0","0","@DiscloseTV","", "", "Disclose TV"
"997599479313379329","https://twitter.com/disclosetv/status/997599479313379329","disclosetv","That sounds too good to be true... but wait it's not actually! https://www. disclose.tv/product-tester -wanted-get-paid-50000-a-year-to-smoke-weed-334224 …", "20180518","3","6","","", "", "Disclose TV"
"997594779318964226","https://twitter.com/DimentBarb/status/997594779318964226","DimentBarb","Cohen’s atty finally got it right on two points: 1) Media Mike is making extrajudicial statements on TV that violate the rules of professional conduct; 2) he failed to disclose a pending investigation against him in CA. https:// twitter.com/chrisgeidner/s tatus/997591027920916481 …", "20180518","0","0","","", "", "Disclose TV"
"997594755734425603","https://twitter.com/Pierce_A_Brown/status/997594755734425603","Pierce_A_Brown","For sure a picture of the Black Books from Skyrim lmao http:// elderscrolls.wikia.com/wiki/Black_Boo ks …", "20180518","1","2","","", "", "Disclose TV"
"997585814505877504","https://twitter.com/MtnLover90/status/997585814505877504","MtnLover90","'Alien Bird' Flies Across Martian Sky In Image Captured By Mars Rover https://www. disclose.tv/alien-bird-fli es-across-martian-sky-in-image-captured-by-mars-rover-334158 … via @DiscloseTV #conspiracy", "20180518","1","1","@DiscloseTV","#conspiracy", "", "Disclose TV"
"997585633936801792","https://twitter.com/olegschramm/status/997585633936801792","olegschramm","#disclosetv https://www. instagram.com/p/Bi7vR8GhbXc/ ?utm_source=ig_twitter_share&igshid=k73s2fc2pspf …", "20180518","0","0","","#disclosetv", "", "Disclose TV"
"997584245936803846","https://twitter.com/scotto965/status/997584245936803846","scotto965","What’s with the picture of Galactus?", "20180518","0","0","","", "", "Disclose TV"
"997583605340700673","https://twitter.com/disclosetv/status/997583605340700673","disclosetv","Picatrix: An ancient and mysterious manuscript. https://www. disclose.tv/the-picatrix-t he-400-page-book-that-reveals-how-to-obtain-energy-from-the-cosmos-314693 …", "20180518","13","18","","", "", "Disclose TV"
"997576589490737152","https://twitter.com/OnkeZulu/status/997576589490737152","OnkeZulu","@JustLeloZulu", "20180518","0","0","@JustLeloZulu","", "", "Disclose TV"
"997573654811631616","https://twitter.com/cartola71/status/997573654811631616","cartola71","Wtf?", "20180518","0","0","","", "", "Disclose TV"
"997573287185145857","https://twitter.com/disclosetv/status/997573287185145857","disclosetv","Is this a creature from a parallel world? https://www. disclose.tv/the-gate-has-o pened-this-insect-seems-to-be-from-another-dimension-315645 …", "20180518","7","8","","", "", "Disclose TV"
"997571147423240195","https://twitter.com/bigfeet555/status/997571147423240195","bigfeet555","Product Tester Wanted! Get Paid $50’000 A Year To Smoke Weed. https://www. disclose.tv/product-tester -wanted-get-paid-50000-a-year-to-smoke-weed-334224 … via @DiscloseTV #society", "20180518","0","0","@DiscloseTV","#society", "", "Disclose TV"
"997565935358824448","https://twitter.com/Elblond23/status/997565935358824448","Elblond23","Retweeted http:// Disclose.tv ( @DiscloseTV ): http://www. disclose.tv pic.twitter.com/41Xw43O3b7 https:// twitter.com/DiscloseTV/sta tus/997504885145915392/photo/1?utm_source=fb&utm_medium=fb&utm_campaign=Elblond23&utm_content=997565912223047680 …", "20180518","0","0","@DiscloseTV","", "", "Disclose TV"
"997559208307503106","https://twitter.com/Daniel_Simons/status/997559208307503106","Daniel_Simons","I'm not sure. I question whether this rover is actually on another planet by the name of Mars anyway. There are many reports that man has been present on Mars for quite some time already..", "20180518","0","0","","", "", "Disclose TV"
"997554472665604096","https://twitter.com/hapawriter/status/997554472665604096","hapawriter","We're here......We have the initial M on our Palms.....in books from 50 to 100 years ago..... We are Empaths; Intuitives; Care Givers....etc.", "20180518","0","0","","", "", "Disclose TV"
"997553162633523201","https://twitter.com/Sasori_113/status/997553162633523201","Sasori_113","Sorry but if that's galactus we are doomed! pic.twitter.com/JLh6jtwDaw", "20180518","0","4","","", "", "Disclose TV"
"997552793824256001","https://twitter.com/Maz_zaroth/status/997552793824256001","Maz_zaroth","pic.twitter.com/ngx7LfdMkj", "20180518","0","0","","", "", "Disclose TV"
"997552664157343749","https://twitter.com/disclosetv/status/997552664157343749","disclosetv","They've always been here: https://www. disclose.tv/fbi-document-e arth-has-been-visited-by-beings-from-a-parallel-world-313206 …", "20180518","25","51","","", "", "Disclose TV"
"997546582252847104","https://twitter.com/bigfeet555/status/997546582252847104","bigfeet555","Boeing 737 Passenger Plane Crashed After Takeoff From Havana Airport https://www. disclose.tv/boeing-737-pas senger-plane-crashed-after-takeoff-from-havana-airport-334212 … via @DiscloseTV #worldnews", "20180518","0","0","@DiscloseTV","#worldnews", "", "Disclose TV"
"997543174779256832","https://twitter.com/Xera_Arts/status/997543174779256832","Xera_Arts","C'mon guys It's Godzilla", "20180518","0","0","","", "", "Disclose TV"
"997542365496688640","https://twitter.com/hapawriter/status/997542365496688640","hapawriter","The Alien....!", "20180518","0","0","","", "", "Disclose TV"
"997540584503103488","https://twitter.com/disclosetv/status/997540584503103488","disclosetv","These things look like something out of a science fiction movie. https://www. disclose.tv/alien-like-lav a-eggs-just-appeared-in-hawaii-334164 …", "20180518","6","16","","", "", "Disclose TV"
"997539185308282880","https://twitter.com/hapawriter/status/997539185308282880","hapawriter","Well, doesn't that statement just open up a can of worm for many continuing to be driven off their tribal lands around the world....", "20180518","0","0","","", "", "Disclose TV"
"997539127338979328","https://twitter.com/EpikSoothsayer/status/997539127338979328","EpikSoothsayer","Time to stop mocking the flat fathers and do your own research. #ResearchFlatEarth", "20180518","0","0","","#ResearchFlatEarth", "", "Disclose TV"
"997534563550216192","https://twitter.com/cartola71/status/997534563550216192","cartola71","Kool", "20180518","0","0","","", "", "Disclose TV"
"997528691369545728","https://twitter.com/MMarmax7/status/997528691369545728","MMarmax7","Did they kill him?", "20180518","0","0","","", "", "Disclose TV"
"997522967302197249","https://twitter.com/disclosetv/status/997522967302197249","disclosetv","This shark was born around 1505: https://www. disclose.tv/ancient-shark- said-to-be-worlds-oldest-living-vertebrate-at-512-years-old-316534 …", "20180518","7","12","","", "", "Disclose TV"
"997514448213594112","https://twitter.com/KarriBeth30/status/997514448213594112","KarriBeth30","There Are Ancient Trees On Our Planet That Are Thousands And Thousands Of Years Old https://www. disclose.tv/there-are-anci ent-trees-on-our-planet-that-are-thousands-and-thousands-of-years-old-315631 … via @DiscloseTV #history", "20180518","0","0","@DiscloseTV","#history", "", "Disclose TV"
"997510403952431104","https://twitter.com/disclosetv/status/997510403952431104","disclosetv","http://www. disclose.tv pic.twitter.com/cfYGzh7Ca2", "20180518","5","12","","", "", "Disclose TV"
"997504885145915392","https://twitter.com/disclosetv/status/997504885145915392","disclosetv","http://www. disclose.tv pic.twitter.com/6kzarpVME1", "20180518","27","59","","", "", "Disclose TV"
"997504025720324096","https://twitter.com/UFOL3TA/status/997504025720324096","UFOL3TA","@AntonioParis can you please confirm the authenticity of this image? :-0", "20180518","0","0","@AntonioParis","", "", "Disclose TV"
"997472884292571136","https://twitter.com/CITROENatorPSN/status/997472884292571136","CITROENatorPSN","Extraordinary Footage Of A UFO In Broad Daylight Over Las Vegas https://www. disclose.tv/extraordinary- footage-of-a-ufo-in-broad-daylight-over-las-vegas-334176 … via @DiscloseTV #aliens", "20180518","0","2","@DiscloseTV","#aliens", "", "Disclose TV"
"997472017912942592","https://twitter.com/vairton5550/status/997472017912942592","vairton5550","Multiple UFO Sightings Near Malmstrom's Air Force Base, Which Appears To Be Under Alien Control https://www. disclose.tv/multiple-ufo-s ightings-near-malmstroms-air-force-base-which-appears-to-be-under-alien-control-334065 … via @DiscloseTV #aliens", "20180518","0","1","@DiscloseTV","#aliens", "", "Disclose TV"
"997456773392076800","https://twitter.com/disclosetv/status/997456773392076800","disclosetv","Exactly! http://www. disclose.tv pic.twitter.com/JPc8Xw9teC", "20180518","19","36","","", "", "Disclose TV"
"997456604269305856","https://twitter.com/Marsie100/status/997456604269305856","Marsie100","Or just photoshop by conspiracy theorist", "20180518","0","0","","", "", "Disclose TV"
"997451456096677888","https://twitter.com/Kevin_Nichol/status/997451456096677888","Kevin_Nichol","@Daniel_Simons have a look at the full video on YouTube", "20180518","0","0","@Daniel_Simons","", "", "Disclose TV"
"997446546525446144","https://twitter.com/Ardhen723/status/997446546525446144","Ardhen723","free PR The hell you say.. that's help for Federal Investigators. Note.. trump HAD to disclose the Stormy payment finally because Rudie went on TV and as trump's lawyer (speaking as direct proxy) admitted trump repaid cohen.", "20180518","0","0","","", "", "Disclose TV"
"997444988391841797","https://twitter.com/FriePresseDK/status/997444988391841797","FriePresseDK","space does not exits sorry too burst your buble", "20180518","0","0","","", "", "Disclose TV"
"997441197567291392","https://twitter.com/bcos_tv/status/997441197567291392","bcos_tv","FG Prepared For Ebola Outbreak - FAAN, NCDC Disclose http:// tinyurl.com/ybz7hsg2", "20180518","0","0","","", "", "Disclose TV"
"997439296008142848","https://twitter.com/UFOL3TA/status/997439296008142848","UFOL3TA","Whoa! That's a bird!", "20180518","0","0","","", "", "Disclose TV"
"997435142464565248","https://twitter.com/disclosetv/status/997435142464565248","disclosetv","Either Mars is inhabited or this photo was taken on Earth... https://www. disclose.tv/alien-bird-fli es-across-martian-sky-in-image-captured-by-mars-rover-334158 …", "20180518","35","46","","", "", "Disclose TV"
"997427532113858561","https://twitter.com/SafiyahNoor1/status/997427532113858561","SafiyahNoor1","Indeed it is, if a prosecutor can establish intent to not disclose . @MichealAvenatti once again boxed Trump in brilliantly. Waiting for Summer Z’s atty’s discovery request for the outtakes and hot mic recording that are the life blood of reality tv . Two lawyers gettin’ it done.", "20180518","0","0","@MichealAvenatti","", "", "Disclose TV"
"997416494983270400","https://twitter.com/Davecannell/status/997416494983270400","Davecannell","Unless your cat is your dinner", "20180518","0","1","","", "", "Disclose TV"
"997348915832909824","https://twitter.com/LauraJade_U/status/997348915832909824","LauraJade_U","I love you Lee hahaha", "20180518","0","0","","", "", "Disclose TV"
"997320836150214656","https://twitter.com/Cal_Para/status/997320836150214656","Cal_Para","Jury Use Ouija Board To Find Guilty Verdict https://www. disclose.tv/jury-use-ouija -board-to-find-guilty-verdict-333555 … via @DiscloseTV #paranormal", "20180517","0","0","@DiscloseTV","#paranormal", "", "Disclose TV"
"997320760963170304","https://twitter.com/Cal_Para/status/997320760963170304","Cal_Para","Families Run Screaming From Cinema As This Trailer For A Horror Movie Played Before Peter Rabbit https://www. disclose.tv/families-run-s creaming-from-cinema-as-this-trailer-for-a-horror-movie-played-before-peter-rabbit-333570 … via @DiscloseTV #paranormal", "20180517","0","0","@DiscloseTV","#paranormal", "", "Disclose TV"
"997320684287049729","https://twitter.com/Cal_Para/status/997320684287049729","Cal_Para","CCTV Camera Captures A Strange Winged Creature, Real ‘angel’ Sighting? https://www. disclose.tv/cctv-camera-ca ptures-a-strange-winged-creature-real-angel-sighting-333642 … via @DiscloseTV #paranormal", "20180517","0","0","@DiscloseTV","#paranormal", "", "Disclose TV"
"997320637705154560","https://twitter.com/Cal_Para/status/997320637705154560","Cal_Para","Girl Thrown Into The Air By Strange Forces. Give A Logical Explanation For This! https://www. disclose.tv/girl-thrown-in to-the-air-by-strange-forces-give-a-logical-explanation-for-this-333771 … via @DiscloseTV #paranormal", "20180517","0","0","@DiscloseTV","#paranormal", "", "Disclose TV"
"997320584802418688","https://twitter.com/Cal_Para/status/997320584802418688","Cal_Para","Security Guard Films Ghost As He Wants To Examine A Door That Opens And Slams By Itself https://www. disclose.tv/security-guard -films-ghost-as-he-wants-to-examine-a-door-that-opens-and-slams-by-itself-334032 … via @DiscloseTV #paranormal", "20180517","0","0","@DiscloseTV","#paranormal", "", "Disclose TV"
"997320497082880006","https://twitter.com/Cal_Para/status/997320497082880006","Cal_Para","Are The Sea People Real ? Look At This Creature And Judge Yourself .! https://www. disclose.tv/are-the-sea-pe ople-real-look-at-this-creature-and-judge-yourself-334152 … via @DiscloseTV #paranormal", "20180517","0","0","@DiscloseTV","#paranormal", "", "Disclose TV"
"997285401164484609","https://twitter.com/JaseWhiteHorse/status/997285401164484609","JaseWhiteHorse","Kick it into next door garden", "20180517","0","0","","", "", "Disclose TV"
"997269509391179776","https://twitter.com/CubCarson/status/997269509391179776","CubCarson","Put a hat on him & name him Chet.", "20180517","0","0","","", "", "Disclose TV"
"997258904676401152","https://twitter.com/sammychii/status/997258904676401152","sammychii","Get someone else to poke it", "20180517","0","0","","", "", "Disclose TV"
"997258632092835841","https://twitter.com/cartola71/status/997258632092835841","cartola71","Wtf?", "20180517","0","0","","", "", "Disclose TV"
"997256315708686337","https://twitter.com/keithsunderlan3/status/997256315708686337","keithsunderlan3","Oh sure where Hannity doesn’t have to disclose defending his own lawyer on TV every night.", "20180517","0","0","","", "", "Disclose TV"
"997255445881507840","https://twitter.com/disclosetv/status/997255445881507840","disclosetv","NASA received a response from the void, and believers everywhere are losing their minds. https://www. disclose.tv/nasa-receives- response-from-a-spacecraft-13-billion-miles-away-328082 …", "20180517","9","19","","", "", "Disclose TV"
"997237099467337731","https://twitter.com/disclosetv/status/997237099467337731","disclosetv","Lilith: Demon and first wife of Adam https://www. disclose.tv/lilith-was-ada ms-first-wife-not-eve-but-the-bible-kept-it-secret-315540 …", "20180517","3","9","","", "", "Disclose TV"
"997221236282445825","https://twitter.com/disclosetv/status/997221236282445825","disclosetv","The deputy who refused to confront the gunman during the Parkland shooting was allowed to quietly retire and is now receiving more than $100,000 a year in state pension funds. https://www. disclose.tv/cop-who-didnt- confront-parkland-shooter-now-receives-87k-per-month-pension-334020 …", "20180517","4","1","","", "", "Disclose TV"
"997216636439539713","https://twitter.com/RAndrewOhge/status/997216636439539713","RAndrewOhge","How Rockefeller Found Big Pharma And Destroyed Natural Cures https://www. disclose.tv/how-rockefelle r-found-big-pharma-and-destroyed-natural-cures-331632 … via @DiscloseTV #health", "20180517","0","0","@DiscloseTV","#health", "", "Disclose TV"
"997215260019916801","https://twitter.com/BatterVaughanta/status/997215260019916801","BatterVaughanta","PLEASE SHARE AND WAKE UP EVERYONE TO THIS DECEITFUL WORLD WE'VE BEEN LIVING IN!", "20180517","0","0","","", "", "Disclose TV"
"997214847732535297","https://twitter.com/BatterVaughanta/status/997214847732535297","BatterVaughanta","Dr. Michio Kaku's Shocking Confession On TV : HAARP Is Responsible For The Recent Spate Of Hurricanes | http:// Disclose.tv https://www. disclose.tv/dr-michio-kaku s-shocking-confession-on-tv-haarp-is-responsible-for-the-recent-spate-of-hurricanes-315335 … via @DiscloseTV #prepping", "20180517","3","3","@DiscloseTV","#prepping", "", "Disclose TV"
"997210967053361153","https://twitter.com/disclosetv/status/997210967053361153","disclosetv","Oh, the sound… https://www. disclose.tv/what-happens-w hen-a-tree-branch-falls-on-power-lines-334014 …", "20180517","2","1","","", "", "Disclose TV"
"997204888173064192","https://twitter.com/chrisseyc32/status/997204888173064192","chrisseyc32","Stop sniffin Glue!!!", "20180517","0","1","","", "", "Disclose TV"
"997201224016519168","https://twitter.com/lukeH2016/status/997201224016519168","lukeH2016","Take it home an poach it", "20180517","0","1","","", "", "Disclose TV"
"997199494985941005","https://twitter.com/RocktoberSky/status/997199494985941005","RocktoberSky","The Vatican Has an Observatory in Mt. Graham!", "20180517","0","2","","", "", "Disclose TV"
"997199323749380096","https://twitter.com/ufosfootage/status/997199323749380096","ufosfootage","CERN Messed Up Big Time PROOF That We All DIED IN 2012 | http:// Disclose.tv https://www. disclose.tv/cern-messed-up -big-time-proof-that-we-all-died-in-2012-334110 … via @DiscloseTV #prophecy", "20180517","0","0","@DiscloseTV","#prophecy", "", "Disclose TV"
"997190262832205833","https://twitter.com/disclosetv/status/997190262832205833","disclosetv","Not only did the officer swiftly escalate to unnecessary deadly force against a naked man, but now the department is telling the public that it was justified.. https://www. disclose.tv/police-officer -shot-naked-unarmed-teacher-being-naked-does-not-remove-a-threat-334029 …", "20180517","1","0","","", "", "Disclose TV"
"997187300558868480","https://twitter.com/l_lefauxpas/status/997187300558868480","l_lefauxpas","Disclose to journalists but STAY OFF tv .", "20180517","0","0","","", "", "Disclose TV"
"997184305481863168","https://twitter.com/BadGuy209/status/997184305481863168","BadGuy209","Right. But it's in Arizona not the Vatican.", "20180517","0","1","","", "", "Disclose TV"
"997178194569715712","https://twitter.com/disclosetv/status/997178194569715712","disclosetv","http://www. disclose.tv pic.twitter.com/FTrZCcNkma", "20180517","11","7","","", "", "Disclose TV"
"997172858601295872","https://twitter.com/disclosetv/status/997172858601295872","disclosetv","Hawaii’s #Kilauea volcano just EXPLODED - ballistic blocs size of CARS fired https://www. disclose.tv/explosive-erup tion-at-hawaiis-kilauea-volcano-334080 …", "20180517","4","0","","#Kilauea", "", "Disclose TV"
"997172205346803712","https://twitter.com/Pussilicca/status/997172205346803712","Pussilicca","Man Catches Strange Phenomenon In The Sky | http:// Disclose.tv https://www. disclose.tv/man-catches-st range-phenomenon-in-the-sky-333951?utm_source=newsletter&utm_medium=mail&utm_campaign=disclose_daily_05_17_2018&nlctsi=Ny94U3hLOGNtcXpwRmNBWHZhZTRsQT09 … via @DiscloseTV #aliens", "20180517","1","0","@DiscloseTV","#aliens", "", "Disclose TV"
"997165950242869248","https://twitter.com/jagatsinghChou3/status/997165950242869248","jagatsinghChou3","The show of the debate on Republic TV is very interesting to disclose the people hunger of power. Last night was the historical night of media’s No-1 Republic TV . Arnab Goswami is the magician who always brought on the show from different ideology. Catch on the spot. Tremendous.", "20180517","0","1","","", "", "Disclose TV"
"997165622273478656","https://twitter.com/147Luuk/status/997165622273478656","147Luuk","Coincidence or not, but someone really had way too much free time!", "20180517","0","0","","", "", "Disclose TV"
"997163001093308419","https://twitter.com/LenkaPravakar/status/997163001093308419","LenkaPravakar","Shezad interpretation is up to the mark..Tahseen it's honest request don't come to TV debate..not only u disclose yourself but u exposed ur political master PIDI ", "20180517","0","0","","", "", "Disclose TV"
"997161603253657600","https://twitter.com/RocktoberSky/status/997161603253657600","RocktoberSky","Interesting... There Are Others Besides Them That Post Similar Stuff and Some Turn Out to Be True. Not Everyone is Trash. People Who Harm Others in Secret for Their Sick and Twisted Pleasure, Definitively Are Trash.", "20180517","0","0","","", "", "Disclose TV"
"997160578253803522","https://twitter.com/disclosetv/status/997160578253803522","disclosetv","http://www. disclose.tv pic.twitter.com/1xCjroRDRL", "20180517","7","22","","", "", "Disclose TV"
"997158802460901377","https://twitter.com/BadGuy209/status/997158802460901377","BadGuy209","Yeah. I was curious so did a quick google and was disproved in seconds. Lots of discloses posts are trash sadly", "20180517","0","0","","", "", "Disclose TV"
"997148972107083776","https://twitter.com/JaseWhiteHorse/status/997148972107083776","JaseWhiteHorse","Crazy", "20180517","0","1","","", "", "Disclose TV"
"997147990098894850","https://twitter.com/disclosetv/status/997147990098894850","disclosetv","http://www. disclose.tv pic.twitter.com/RPcYlSDhLe", "20180517","2","9","","", "", "Disclose TV"
"997147094694662145","https://twitter.com/RocktoberSky/status/997147094694662145","RocktoberSky","Really?", "20180517","0","0","","", "", "Disclose TV"
"997145422610223106","https://twitter.com/BadGuy209/status/997145422610223106","BadGuy209","Fake news", "20180517","0","0","","", "", "Disclose TV"
"997142454192300033","https://twitter.com/disclosetv/status/997142454192300033","disclosetv","Which heavenly visitor is the Vatican waiting for? http://www. disclose.tv pic.twitter.com/XKzonMZH49", "20180517","40","47","","", "", "Disclose TV"
"997132454426238977","https://twitter.com/sammie_m73/status/997132454426238977","sammie_m73","Ohh a new pet...", "20180517","0","0","","", "", "Disclose TV"
"997131957401260032","https://twitter.com/thelee_x_w/status/997131957401260032","thelee_x_w","If chuck an incendiary grenade it's way n leg it", "20180517","0","1","","", "", "Disclose TV"
"997121169361862656","https://twitter.com/EpikSoothsayer/status/997121169361862656","EpikSoothsayer","Barbecue that motherfucker!", "20180517","0","1","","", "", "Disclose TV"
"997118566901174272","https://twitter.com/pccarver816/status/997118566901174272","pccarver816","Keep an eye out for that chicken", "20180517","0","1","","", "", "Disclose TV"
"997114532957949952","https://twitter.com/Dah_mi/status/997114532957949952","Dah_mi","Dumb Ass! Anything they want to do they announce it on TV or Radio. I don't know if they weren't taught not to disclose strategy plan to their opponent. https:// twitter.com/udomekem/statu s/997077395332108288 …", "20180517","1","0","","", "", "Disclose TV"
"997113638640070656","https://twitter.com/D_Williams101/status/997113638640070656","D_Williams101","Stick your head in it of course", "20180517","0","0","","", "", "Disclose TV"
"997113541160263680","https://twitter.com/147Luuk/status/997113541160263680","147Luuk","Stick my face in it", "20180517","0","1","","", "", "Disclose TV"
"997110848773672960","https://twitter.com/c_chanter/status/997110848773672960","c_chanter","I’m a gambling Man by nature, so I’d go ahead and stick my face in it.", "20180517","0","0","","", "", "Disclose TV"
"997110001197113344","https://twitter.com/SusanAndPets/status/997110001197113344","SusanAndPets","Seems You knew about the payment to @StormyDaniels . You didn't disclose this last year when you filed You participated in the cover up of your son meeting with Russians to uncover dirt on your political opponent. Seems Rudy isn't a great lawyer nor TV representative.", "20180517","0","3","@StormyDaniels","", "", "Disclose TV"
