id,url,account,text,date,retweet,favorite,mentioned,hashtags,geotags,keyword
"992025691511238656","https://twitter.com/pamela_j/status/992025691511238656","pamela_j","Hahahahahaha not if you disclose it on national tv it is not! No privilege attaches once the lawyer spills the beans.", "20180503","0","0","","", "", "Disclose TV"
"992020974571806720","https://twitter.com/disclosetv/status/992020974571806720","disclosetv","Experts determined that at just 10 years old she had the mental capabilities of a 23-year-old. https://www. disclose.tv/this-women-has -the-highest-iq-ever-recorded-332886 …", "20180503","8","11","","", "", "Disclose TV"
"991999311096565760","https://twitter.com/disclosetv/status/991999311096565760","disclosetv","http://www. disclose.tv pic.twitter.com/mPzsQhTakw", "20180503","9","15","","", "", "Disclose TV"
"991925116010401792","https://twitter.com/sarvmanglamcom/status/991925116010401792","sarvmanglamcom","Please, please ask the honorable P. M of India to  at least once tell the truth and disclose the number of clothes that he uses during last 4 years? Interestingly, few persons have counted thousands of costly pairs_ as seen on tv channels during 2014_2018 . #VoteMaadi4BJP https:// twitter.com/mkvenu1/status /991729540123815936 …", "20180503","6","7","","#VoteMaadi4BJP", "", "Disclose TV"
"991890700860932097","https://twitter.com/ItzQuauhtli/status/991890700860932097","ItzQuauhtli","Recycling Innovator Faces Prison For Trying To Extend Life Of Computers | http:// Disclose.tv https://www. disclose.tv/recycling-inno vator-faces-prison-for-trying-to-extend-life-of-electronic-devices-332784 … v @DiscloseTV #activism", "20180503","0","0","@DiscloseTV","#activism", "", "Disclose TV"
"991876544350928896","https://twitter.com/XMEN_DOFP_Logan/status/991876544350928896","XMEN_DOFP_Logan","Your 'Drunk Self' May Actually Be The Real You, According To Scientists https://www. disclose.tv/your-drunk-sel f-may-actually-be-the-real-you-according-to-scientists-332796 … via @DiscloseTV #science", "20180502","0","2","@DiscloseTV","#science", "", "Disclose TV"
"991872515289972736","https://twitter.com/edbrasslaw/status/991872515289972736","edbrasslaw","How do these TV pundit lawyers disclose all sorts of confidences and remain licensed.", "20180502","1","34","","", "", "Disclose TV"
"991829111415943168","https://twitter.com/violet1967/status/991829111415943168","violet1967","Former CIA Officer: Clinton Charity Fraud Is 'Biggest Scandal In US History' | http:// Disclose.tv https://www. disclose.tv/former-cia-off icer-clinton-charity-fraud-is-biggest-scandal-in-us-history-332421 … via @DiscloseTV #politics", "20180502","0","0","@DiscloseTV","#politics", "", "Disclose TV"
"991828369091301376","https://twitter.com/violet1967/status/991828369091301376","violet1967","I'm a happy drunk .....Your 'Drunk Self' May Actually Be The Real You, According To Scientists https://www. disclose.tv/your-drunk-sel f-may-actually-be-the-real-you-according-to-scientists-332796 … via @DiscloseTV #science", "20180502","0","0","@DiscloseTV","#science", "", "Disclose TV"
"991827053774241792","https://twitter.com/ianwright109/status/991827053774241792","ianwright109","Hello everyone what now mmmmmmm mmmmmmm mmmmmmm different funny.", "20180502","0","0","","", "", "Disclose TV"
"991825725316415488","https://twitter.com/ianwright109/status/991825725316415488","ianwright109","Hello everyone what now mmmmmmm mmmmmmm mmmmmmm very interesting.", "20180502","0","0","","", "", "Disclose TV"
"991819666577330176","https://twitter.com/disclosetv/status/991819666577330176","disclosetv","One of the best things we’ve ever seen: https://www. disclose.tv/trump-kim-jong -un-gangnam-style-video-takes-internet-by-storm-332841 …", "20180502","6","10","","", "", "Disclose TV"
"991816026290614273","https://twitter.com/whatever2100/status/991816026290614273","whatever2100","Living through the same sort of thing with the Minnesota Metropolitan Council and their government unions myself - believe me, I'm fuming alright, because I KNOW exactly how this crap goes down!!", "20180502","2","1","","", "", "Disclose TV"
"991809821929365504","https://twitter.com/RicardoG1981/status/991809821929365504","RicardoG1981","Isn't that common knowleage?", "20180502","0","0","","", "", "Disclose TV"
"991805484138147840","https://twitter.com/BillPeriman/status/991805484138147840","BillPeriman","You Will Be FUMING After Watching This New Project Veritas Video https://www. disclose.tv/you-will-be-fu ming-after-watching-this-new-project-veritas-video-332847 … via @DiscloseTV #society", "20180502","3","3","@DiscloseTV","#society", "", "Disclose TV"
"991804712969228294","https://twitter.com/D_Williams101/status/991804712969228294","D_Williams101","Who is your demon?", "20180502","0","0","","", "", "Disclose TV"
"991804571939954689","https://twitter.com/BillPeriman/status/991804571939954689","BillPeriman","Recycling Innovator Faces Prison For Trying To Extend Life Of Computers https://www. disclose.tv/recycling-inno vator-faces-prison-for-trying-to-extend-life-of-electronic-devices-332784 … via @DiscloseTV #activism", "20180502","1","0","@DiscloseTV","#activism", "", "Disclose TV"
"991804397112954880","https://twitter.com/ajamesb39/status/991804397112954880","ajamesb39","Summoning demons is bad mok, but if you summon this demon you might get laid. Where do I sign up?.", "20180502","0","0","","", "", "Disclose TV"
"991801271702171648","https://twitter.com/disclosetv/status/991801271702171648","disclosetv","http://www. disclose.tv pic.twitter.com/O9XGAjNFYZ", "20180502","4","7","","", "", "Disclose TV"
"991785416901709825","https://twitter.com/disclosetv/status/991785416901709825","disclosetv","http://www. disclose.tv pic.twitter.com/wDMnoVyhk4", "20180502","8","4","","", "", "Disclose TV"
"991784144316370944","https://twitter.com/bigfeet555/status/991784144316370944","bigfeet555","Sugar, The Sweet Poison That Kills Us All https://www. disclose.tv/sugar-the-swee t-poison-that-kills-us-all-332781 … via @DiscloseTV #health", "20180502","0","0","@DiscloseTV","#health", "", "Disclose TV"
"991782322621075458","https://twitter.com/bigfeet555/status/991782322621075458","bigfeet555","Cancer-Linked Glyphosat Discovered In EVERY Food Tested, Except Broccoli https://www. disclose.tv/cancer-linked- glyphosat-discovered-in-every-food-tested-except-broccoli-332778 … via @DiscloseTV #health", "20180502","0","0","@DiscloseTV","#health", "", "Disclose TV"
"991781032872554496","https://twitter.com/Dmonix/status/991781032872554496","Dmonix","I am THE DeMon and I poop in your general direction D.tvee ... Piece of crap forum HA!", "20180502","0","0","","", "", "Disclose TV"
"991779369709285376","https://twitter.com/sedonasundial/status/991779369709285376","sedonasundial","I don't think that'll be necessary.", "20180502","0","0","","", "", "Disclose TV"
"991775832095035392","https://twitter.com/beast_anti/status/991775832095035392","beast_anti","This is probably true but how could anyone trust a DEMON hahahaha", "20180502","0","0","","", "", "Disclose TV"
"991775081243308032","https://twitter.com/disclosetv/status/991775081243308032","disclosetv","Once you've established trust with the demon, you won't need to perform any rituals again and it will be with you the rest of your life. https://www. disclose.tv/summoning-a-de mon-is-one-of-the-worst-thing-you-could-ever-do-332799 …", "20180502","2","4","","", "", "Disclose TV"
"991755866994040833","https://twitter.com/Alx_th/status/991755866994040833","Alx_th","That is why most politicians have religious affiliations.", "20180502","0","0","","", "", "Disclose TV"
"991754733655396353","https://twitter.com/DanielJohnMoor1/status/991754733655396353","DanielJohnMoor1","It doesn’t belong to humans", "20180502","0","0","","", "", "Disclose TV"
"991754449604562944","https://twitter.com/disclosetv/status/991754449604562944","disclosetv","Hmm, anyone else notice a pattern here? https://www. disclose.tv/moon-mission-c anceled-again-332820 …", "20180502","1","3","","", "", "Disclose TV"
"991754185254334464","https://twitter.com/marvinhays55/status/991754185254334464","marvinhays55","This Is Why Harvard Scientists Urge People To Stop Drinking Low-Fat Milk | http:// Disclose.tv https://www. disclose.tv/this-is-why-ha rvard-scientists-urge-people-to-stop-drinking-low-fat-milk-332631 … via @DiscloseTV #health", "20180502","0","0","@DiscloseTV","#health", "", "Disclose TV"
"991750235717332993","https://twitter.com/VanicekPetr/status/991750235717332993","VanicekPetr","Cancer-Linked Glyphosat Discovered In EVERY Food Tested, Except Broccoli https://www. disclose.tv/cancer-linked- glyphosat-discovered-in-every-food-tested-except-broccoli-332778?utm_source=Facebook&utm_medium=newsbot … via @DiscloseTV #health", "20180502","0","0","@DiscloseTV","#health", "", "Disclose TV"
"991742380725428226","https://twitter.com/disclosetv/status/991742380725428226","disclosetv","This is such a cool test! https://www. disclose.tv/how-to-detect- negative-energies-you-only-need-a-glass-of-water-313336 …", "20180502","8","14","","", "", "Disclose TV"
"991735298718666752","https://twitter.com/ErinnRoebuck/status/991735298718666752","ErinnRoebuck","Largest cult..... Religion. Be Spiritual, be free, believe. Don't conform to the lies and threat/scare tactics of the religious cults. Divine creator allows freedom and uniqueness. Not fear, control & conformity. Religion brainwashes.", "20180502","0","0","","", "", "Disclose TV"
"991724801726218241","https://twitter.com/disclosetv/status/991724801726218241","disclosetv","This is bad news for some people: https://www. disclose.tv/your-drunk-sel f-may-actually-be-the-real-you-according-to-scientists-332796 …", "20180502","5","7","","", "", "Disclose TV"
"991717211436912640","https://twitter.com/magsmills/status/991717211436912640","magsmills","The Terrifying Real Reason Why North Korea Halted Their Nuclear Program | http:// Disclose.tv https://www. disclose.tv/the-terrifying -real-reason-why-north-korea-halted-their-nuclear-program-332475?utm_source=newsletter&utm_medium=mail&utm_campaign=disclose_digest_18_2018 … via @DiscloseTV #conspiracy", "20180502","0","0","@DiscloseTV","#conspiracy", "", "Disclose TV"
"991712836907884545","https://twitter.com/JDanks15/status/991712836907884545","JDanks15","TRUMP & KIM JONG UN 'Gangnam Style' Video Takes Internet By Storm | http:// Disclose.tv https://www. disclose.tv/trump-kim-jong -un-gangnam-style-video-takes-internet-by-storm-332841 … via @DiscloseTV #society", "20180502","0","0","@DiscloseTV","#society", "", "Disclose TV"
"991712206445334533","https://twitter.com/disclosetv/status/991712206445334533","disclosetv","http://www. disclose.tv pic.twitter.com/8fvaymYFU7", "20180502","5","12","","", "", "Disclose TV"
"991709831961677828","https://twitter.com/DangerousGlobe/status/991709831961677828","DangerousGlobe","This article is 15 months old, what makes you think things are getting any better? This could kill everything in the Pacific Ocean. Hellooooooooooo Fukushima Radiation: Days Of Eating Pacific Ocean Fish Are Over, Or Worse… https://www. disclose.tv/fukushima-radi ation-days-of-eating-pacific-ocean-fish-are-over-or-worse-315056 … via @DiscloseTV #nature", "20180502","1","1","@DiscloseTV","#nature", "", "Disclose TV"
"991708960641056773","https://twitter.com/pinlight1/status/991708960641056773","pinlight1","Recycling Innovator Faces Prison For Trying To Extend Life Of Computers | http:// Disclose.tv https://www. disclose.tv/recycling-inno vator-faces-prison-for-trying-to-extend-life-of-electronic-devices-332784 … via @DiscloseTV #activism", "20180502","2","2","@DiscloseTV","#activism", "", "Disclose TV"
"991707982588272641","https://twitter.com/EliBCarter/status/991707982588272641","EliBCarter","This is why we stopped evolving", "20180502","0","0","","", "", "Disclose TV"
"991707452763598849","https://twitter.com/tmYapCabrera/status/991707452763598849","tmYapCabrera","", "20180502","0","0","","", "", "Disclose TV"
"991707394211303424","https://twitter.com/BWP420/status/991707394211303424","BWP420","Sheep", "20180502","0","0","","", "", "Disclose TV"
"991706639161024512","https://twitter.com/disclosetv/status/991706639161024512","disclosetv","Thoughts? http://www. disclose.tv pic.twitter.com/lWG8zzebGs", "20180502","29","48","","", "", "Disclose TV"
"991699149082054656","https://twitter.com/istokov/status/991699149082054656","istokov","Seismologists Warn: Catastrophic Mega-Earthquake Could Hit Us Soon https://www. disclose.tv/seismologists- warn-catastrophic-mega-earthquake-could-hit-us-soon-332469?utm_source=newsletter&utm_medium=mail&utm_campaign=disclose_digest_18_2018 … via @DiscloseTV #nature", "20180502","0","0","@DiscloseTV","#nature", "", "Disclose TV"
"991695547097649154","https://twitter.com/Tweetyall919/status/991695547097649154","Tweetyall919","#TodaysBigLesson Don’t elect a washed up reality tv host with multiple failed business, lawsuits, and bankruptcies who cheats on his wives and his workers and won’t even disclose his taxes, especially if he’s also a racist bully with more bad ideas than good ones.", "20180502","0","1","","#TodaysBigLesson", "", "Disclose TV"
"991690815054331905","https://twitter.com/BryceZabel/status/991690815054331905","BryceZabel","Incredibly, #UFO abductee Barney Hill appeared on the show To Tell the Truth. Do you think you'd have picked him or one of the imposters? https:// youtu.be/YhZ24yUpXSM #TruthNow #BZTV @Acecentric @DiscloseTV #UFOs @CITDConference", "20180502","4","6","@Acecentric @DiscloseTV @CITDConference","#UFO #TruthNow #BZTV #UFOs", "", "Disclose TV"
"991683401726898176","https://twitter.com/TheEastShore/status/991683401726898176","TheEastShore","This is complete media bs. Trump revealed all his medical tests on tv . Maybe what was in that letter true. Hillary didnt disclose as much as trump.", "20180502","0","0","","", "", "Disclose TV"
"991680625529761797","https://twitter.com/CryptoUK/status/991680625529761797","CryptoUK","Ancient Aliens' Newest Episode Claims Alien Disclosure Was Put In Full Lockdown With Trump's Election https://www. disclose.tv/ancient-aliens -newest-episode-claims-alien-disclosure-was-put-in-full-lockdown-with-trumps-election-332604 … via @DiscloseTV #aliens", "20180502","0","0","@DiscloseTV","#aliens", "", "Disclose TV"
"991662621928673280","https://twitter.com/aswmotorfactors/status/991662621928673280","aswmotorfactors","he should've just used linux :)", "20180502","0","0","","", "", "Disclose TV"
"991658564820307970","https://twitter.com/disclosetv/status/991658564820307970","disclosetv","He got in the way of Microsoft’s profits, so they pushed this into federal court on false pretense. https://www. disclose.tv/recycling-inno vator-faces-prison-for-trying-to-extend-life-of-electronic-devices-332784 …", "20180502","2","0","","", "", "Disclose TV"
"991636924585607168","https://twitter.com/disclosetv/status/991636924585607168","disclosetv","Sad news: https://www. disclose.tv/cancer-linked- glyphosat-discovered-in-every-food-tested-except-broccoli-332778 …", "20180502","7","1","","", "", "Disclose TV"
"991537768869351430","https://twitter.com/Selinasyfy/status/991537768869351430","Selinasyfy","I actually understand this one!", "20180502","3","8","","", "", "Disclose TV"
"991520845083406341","https://twitter.com/Jeromeo8699/status/991520845083406341","Jeromeo8699","Nightmarish! Polish Painter Learned To “Photograph Dreams” https://www. disclose.tv/nightmarish-po lish-painter-learned-to-photograph-dreams-332553?utm_source=newsletter&utm_medium=mail&utm_campaign=disclose_daily_05_01_2018 … via @DiscloseTV #paranormal", "20180501","0","0","@DiscloseTV","#paranormal", "", "Disclose TV"
"991483417849036800","https://twitter.com/WhirledPeas4Kay/status/991483417849036800","WhirledPeas4Kay","Inventor Of 'Water-powered Car' Dies In A Restaurant Screaming 'They Poisoned Me' https://www. disclose.tv/inventor-of-wa ter-powered-car-dies-in-a-restaurant-screaming-they-poisoned-me-315669 … via @DiscloseTV #conspiracy", "20180501","0","0","@DiscloseTV","#conspiracy", "", "Disclose TV"
"991452236600561664","https://twitter.com/ArchUnicorn/status/991452236600561664","ArchUnicorn","Military Industrial Complex Stocks Crash After North And South Korea Announce End Of War | http:// Disclose.tv https://www. disclose.tv/military-indus trial-complex-stocks-crash-after-north-and-south-korea-announce-end-of-war-332607?utm_source=newsletter&utm_medium=mail&utm_campaign=disclose_daily_05_01_2018 … via @DiscloseTV #activism", "20180501","0","0","@DiscloseTV","#activism", "", "Disclose TV"
"991445669645697024","https://twitter.com/jaazee1/status/991445669645697024","jaazee1","Bombshell Interview: The Government Is Controlled By Globalists https://www. disclose.tv/bombshell-inte rview-the-government-is-controlled-by-globalists-313550 … via @DiscloseTV #politics", "20180501","0","0","@DiscloseTV","#politics", "", "Disclose TV"
"991423076113018880","https://twitter.com/disclosetv/status/991423076113018880","disclosetv","This is alarming ... https://www. disclose.tv/this-is-why-ha rvard-scientists-urge-people-to-stop-drinking-low-fat-milk-332631 …", "20180501","0","3","","", "", "Disclose TV"
"991395694903812097","https://twitter.com/DGS120/status/991395694903812097","DGS120","Port Authority Commissioner Abuses Her Position During N.J. Traffic Stop | http:// Disclose.tv https://www. disclose.tv/port-authority -commissioner-abuses-her-position-during-nj-traffic-stop-332337?utm_source=newsletter&utm_medium=mail&utm_campaign=disclose_daily_04_27_2018 … via @DiscloseTV #activism", "20180501","0","1","@DiscloseTV","#activism", "", "Disclose TV"
"991381891906523137","https://twitter.com/alvarez_gonzale/status/991381891906523137","alvarez_gonzale","it is good to know, I will not eat mice anymore", "20180501","0","1","","", "", "Disclose TV"
"991380579470970882","https://twitter.com/e1ais/status/991380579470970882","e1ais","Cops Claim That Mice Ate Half A Ton Of Missing Marijuana https://www. disclose.tv/cops-claim-tha t-mice-ate-half-a-ton-of-missing-marijuana-332589 … via @DiscloseTV #activism", "20180501","0","0","@DiscloseTV","#activism", "", "Disclose TV"
"991379979253448704","https://twitter.com/disclosetv/status/991379979253448704","disclosetv","Thoughts? https://www. disclose.tv/ancient-aliens -newest-episode-claims-alien-disclosure-was-put-in-full-lockdown-with-trumps-election-332604 …", "20180501","5","9","","", "", "Disclose TV"
"991363293498544129","https://twitter.com/MarCurtis/status/991363293498544129","MarCurtis","Military Industrial Complex Stocks Crash After North And South Korea Announce End Of War https://www. disclose.tv/military-indus trial-complex-stocks-crash-after-north-and-south-korea-announce-end-of-war-332607 … via @DiscloseTV #activism", "20180501","0","0","@DiscloseTV","#activism", "", "Disclose TV"
"991349805355098114","https://twitter.com/disclosetv/status/991349805355098114","disclosetv","Incredible and rare footage: https://www. disclose.tv/qi-gong-master -demonstrates-his-chi-energy-for-the-first-time-in-public-332712 …", "20180501","5","12","","", "", "Disclose TV"
"991344524340285440","https://twitter.com/Jordan_Sather_/status/991344524340285440","Jordan_Sather_","Promoting bad physics and bad health. You can disclose better than that!", "20180501","0","0","","", "", "Disclose TV"
"991344275135827970","https://twitter.com/disclosetv/status/991344275135827970","disclosetv","http://www. disclose.tv pic.twitter.com/vGRj3DYlVu", "20180501","5","13","","", "", "Disclose TV"
"991327577846505474","https://twitter.com/disclosetv/status/991327577846505474","disclosetv","What the hell ... ? https://www. disclose.tv/demonic-image- shown-during-wsmv-tv-channel-4-news-weather-report-332643 …", "20180501","4","10","","", "", "Disclose TV"
"991327044196818944","https://twitter.com/NiceGuy504/status/991327044196818944","NiceGuy504","Cops Claim That Mice Ate Half A Ton Of Missing Marijuana https://www. disclose.tv/cops-claim-tha t-mice-ate-half-a-ton-of-missing-marijuana-332589 … via @DiscloseTV #activism", "20180501","1","1","@DiscloseTV","#activism", "", "Disclose TV"
"991326337439690752","https://twitter.com/ImkenmacMaclean/status/991326337439690752","ImkenmacMaclean","Russian Mars Probe 'Phobos 2' Sent Back Images Of A 20-mile-long Cylindrical Shaped Object, Before Losing Signal https://www. disclose.tv/russian-mars-p robe-phobos-2-sent-back-images-of-a-20-mile-long-cylindrical-shaped-object-before-332601?utm_source=newsletter&utm_medium=mail&utm_campaign=disclose_daily_05_01_2018 … via @DiscloseTV #aliens", "20180501","0","0","@DiscloseTV","#aliens", "", "Disclose TV"
"991312789355540480","https://twitter.com/happyneeraj1994/status/991312789355540480","happyneeraj1994","Satyamev jayte! Truth have no fear to disclose . To know complete information watch sadhna tv 7:40pm #SantRampalji_फिर_बरी pic.twitter.com/t1XBEM8tEw", "20180501","0","0","","#SantRampalji_", "", "Disclose TV"
"991296197376856064","https://twitter.com/disclosetv/status/991296197376856064","disclosetv","The hellish mushroom of human (military) madness... https://www. disclose.tv/color-footage- of-the-largest-nuclear-weapon-ever-detonated-by-the-us-taken-from-50-miles-away-332724 …", "20180501","1","0","","", "", "Disclose TV"
"991276228723314688","https://twitter.com/Anthony69374132/status/991276228723314688","Anthony69374132","What a load of Bollocks Cops Claim That Mice Ate Half A Ton Of Missing Marijuana https://www. disclose.tv/cops-claim-tha t-mice-ate-half-a-ton-of-missing-marijuana-332589 … via @DiscloseTV #activism", "20180501","0","0","@DiscloseTV","#activism", "", "Disclose TV"
"991270637372141568","https://twitter.com/bluestreak_90/status/991270637372141568","bluestreak_90","I’m glad someone won! Rogers did this to me with their cable tv package. Did not disclose that there was a near doubling after 6 months. Cancelled my plan as soon as I saw that, now I just stream. The hell with the big telecoms.", "20180501","0","0","","", "", "Disclose TV"
"991232808034152448","https://twitter.com/AONNRecords/status/991232808034152448","AONNRecords","Neuschwabenland Antarctica's Lost German Colony: Expedition Crew Members Reported Of Battles With Alien Spacecrafts https://www. disclose.tv/neuschwabenlan d-antarcticas-lost-german-colony-expedition-crew-members-reported-of-battles-with-313508 … via @DiscloseTV #aliens", "20180501","0","0","@DiscloseTV","#aliens", "", "Disclose TV"
"991213533214978048","https://twitter.com/ErinnRoebuck/status/991213533214978048","ErinnRoebuck","Truly an amazing artist. Nightmarish! Polish Painter Learned To “Photograph Dreams” | http:// Disclose.tv https://www. disclose.tv/nightmarish-po lish-painter-learned-to-photograph-dreams-332553 … via @DiscloseTV #paranormal", "20180501","0","3","@DiscloseTV","#paranormal", "", "Disclose TV"
"991184891768442880","https://twitter.com/sweepnwin/status/991184891768442880","sweepnwin","Military Industrial Complex Stocks Crash After North And South Korea Announce End Of War https://www. disclose.tv/military-indus trial-complex-stocks-crash-after-north-and-south-korea-announce-end-of-war-332607 … via @DiscloseTV #activism", "20180501","1","2","@DiscloseTV","#activism", "", "Disclose TV"
"1001207762796335105","https://twitter.com/HistoryNevada/status/1001207762796335105","HistoryNevada","Newspaper editor, including the Territorial Enterprise (the exchange and telegraph dispatches) in Virginia City, the Inland Empire in Hamilton, NV, and the Daily Evening Herald in Carson City, Charles A V Putnam was born on May 28, 1828 in Rumford, ME. http:// bit.ly/2GWCH3K", "20180528","0","0","","", "", "Empire Herald"
"1001149458330079236","https://twitter.com/yyc_herald_diff/status/1001149458330079236","yyc_herald_diff","What John Gilchrist Orders at Empire Provisions | Calgary Herald https:// wayback.archive.org/web/2018050311 3531/http://calgaryherald.com/life/swerve/what-john-gilchrist-orders-at-empire-provisions … ➜ https:// wayback.archive.org/web/2018052817 1317/http://calgaryherald.com/life/swerve/what-john-gilchrist-orders-at-empire-provisions … pic.twitter.com/9HOAWDBogP", "20180528","0","0","","", "", "Empire Herald"
"999358048815562752","https://twitter.com/JanetBiggs3/status/999358048815562752","JanetBiggs3","TRYP Hotel in Manhattan NY Times Square: Tryp is minutes from all the city's best attractions like Macy's Herald Square, Jacob Javits Convention Center, Empire State, and Madison Square Garden. Minutes from our front entryway find astounding shopping,… https://www. wesrch.com/business/paper -details/press-paper-BU1H5H000IAHQ-tryp-hotel-in-manhattan-ny-times-square?utm_source=dlvr.it&utm_medium=twitter …", "20180523","0","0","","", "", "Empire Herald"
"999343149825839104","https://twitter.com/RTBalloons/status/999343149825839104","RTBalloons","Idea - just come to the World Herald building and just using the studio when he isn’t there? Just build a podcast empire with stolen equipment", "20180523","0","1","","", "", "Empire Herald"
"999312112894861312","https://twitter.com/Vijaysubbu1/status/999312112894861312","Vijaysubbu1","Many issues brother. No one expects the results. The real intent was and is still missing. DKS is a small fish caught by IT. PC has an empire built where the case going on is by Dr Swamy! SG and RG have only National Herald case against them again by Dr Swamy. https:// twitter.com/arkumar5420/st atus/999309711848570885 …", "20180523","0","0","","", "", "Empire Herald"
"999213189865844736","https://twitter.com/Mike_Empirelpm/status/999213189865844736","Mike_Empirelpm","Fly through the council's £130 million Plymouth property empire - Plymouth Herald https:// ift.tt/2IHnF3x", "20180523","0","0","","", "", "Empire Herald"
