id,url,account,text,date,retweet,favorite,mentioned,hashtags,geotags,keyword
"990585272277626880","https://twitter.com/veronedel11/status/990585272277626880","veronedel11","Vous avez dit Fake news ? Voir les résultats incontournables du sondage BVA , analyse https://www. lavillanumeris.com/180404-fake_ne ws-analyse?recruiter_id=2324 … via @Lavillanumeris", "20180429","3","2","@Lavillanumeris","", "", "BVA News"
"989973405934874624","https://twitter.com/CrissWheeler1/status/989973405934874624","CrissWheeler1","***Breaking News ** BVA says the Lions are going to trade huge to move up and grab one of the prime RBs today.", "20180427","0","0","","", "", "BVA News"
"989597358659915781","https://twitter.com/mrcvsonline/status/989597358659915781","mrcvsonline","RCVS / BVA initiative, Henry Schein merger & more - read the week's news and top jobs here - http:// mrcvs.co.uk/en/enews/2018/ apr/26.html …", "20180426","0","0","","", "", "BVA News"
"989197909165006849","https://twitter.com/satyen_sinha/status/989197909165006849","satyen_sinha","The BVA got caught up in the fake news story when it came out. I believe they issued an apology at the time.", "20180425","0","0","","", "", "BVA News"
"989045099073101824","https://twitter.com/SWAT_studio/status/989045099073101824","SWAT_studio","Les français et les Fake News En Mars, le cabinet BVA a réunit un panel de 1053 français âgés de 18 ans ou plus pour mesurer leur rapport aux Fake News . On retient : 31% des Français partagent des informations sans vérifier la source https:// buff.ly/2Iy7aq2 Merci @BlogModerateur pic.twitter.com/18dIasW0wS", "20180425","0","0","@BlogModerateur","", "", "BVA News"
"987304905634435073","https://twitter.com/MyPE/status/987304905634435073","MyPE","PE News - New BVA arts graduates use creativity to change society: Conscious of the critical role artists can… https:// goo.gl/fb/zsDpFN", "20180420","0","0","","", "", "BVA News"
"985791106704183296","https://twitter.com/BVMed/status/985791106704183296","BVMed","Unsere #MedTech - News der Woche im neuen #BVMed -Newsletter: #BVA moniert sensible #Hilfsmittel -Ausschreibungen #Diabetes und #Medizintechnik #Brauksiepe neuer #Patientenbeauftragter #DIMDI #Patientensicherheit https://www. bvmed.de/de/bvmed/publi kationen/bvmed-newsletter/bvmed-newsletter-15-18 … pic.twitter.com/YU37fQjKmN", "20180416","0","0","","#MedTech #BVMed #BVA #Hilfsmittel #Diabetes #Medizintechnik #Brauksiepe #Patientenbeauftragter #DIMDI #Patientensicherheit", "", "BVA News"
"984687665198006272","https://twitter.com/Compliances_/status/984687665198006272","Compliances_","Laurent Lequien nommé #CDO Chief Data Officer de @Groupe_ BVA http:// ow.ly/iPpH30jt8I0 via @CB_ News", "20180413","0","0","@Groupe_ @CB_","#CDO", "", "BVA News"
"984115550652649472","https://twitter.com/VetShow/status/984115550652649472","VetShow","BREAKING NEWS The equine conference programme for 2018 is now LIVE on our website! Check it out tonight and book your pass with special discount code EQ225 for just £225+VAT*! https://www. londonvetshow.co.uk/conference-pro gramme-2018 … (* BVA /BEVA members receive further discount) pic.twitter.com/2SLFzHv9m3", "20180411","11","11","","", "", "BVA News"
"983992770250575877","https://twitter.com/CompanionAni/status/983992770250575877","CompanionAni","A live export ban would be very good news for animal welfare. Good to see BVA leading on this. #HookNotHoof #animalwelfare https:// twitter.com/BritishVets/st atus/983991616980639744 …", "20180411","0","0","","#HookNotHoof #animalwelfare", "", "BVA News"
"983427373356978177","https://twitter.com/verobagheri/status/983427373356978177","verobagheri","Fake news > Sondage BVA , infographie https://www. lavillanumeris.com/180404-fake_ne ws-infographie … via @Lavillanumeris", "20180409","0","0","@Lavillanumeris","", "", "BVA News"
"982184916837253120","https://twitter.com/CB_News/status/982184916837253120","CB_News","#CONSEIL @Groupe_ BVA renforce son pôle customer experience avec l’acquisition de Côté Clients. http:// bit.ly/2GEIfok pic.twitter.com/oZgjteZV4l", "20180406","2","2","@Groupe_","#CONSEIL", "", "BVA News"
"981989983115497472","https://twitter.com/veroregnier/status/981989983115497472","veroregnier","Chouette, chouette, chouette ! De nouveaux collègues et de nouveaux challenges ! Welcome #CotéClients @Groupe_ BVA acquiert Côté Clients http://www. cbnews.fr/conseils/bva-a cquiert-cote-clients-a1041737 … via @cb_ news @PrintempsEtudes #marketresearch", "20180405","0","1","@Groupe_ @cb_ @PrintempsEtudes","#Cot #marketresearch", "", "BVA News"
"981574709702791168","https://twitter.com/lumenews/status/981574709702791168","lumenews","Les médias : remparts contre les fake news  https:// ift.tt/2GygQ34 Cela fait quand même froid dans le dos : selon le tout récent sondage réalisé par BVA pour la villa numeris, 75% de nos compatriotes estiment avoir déjà été confrontés à une information fausse destinée à les …", "20180404","0","0","","", "", "BVA News"
"981543650940383237","https://twitter.com/david_lacombled/status/981543650940383237","david_lacombled","76% des Français ont confiance dans les médias traditionnels face aux fake news ( BVA /La villa numeris). J'ai dévoilé ce sondage au cours de la Conférence internationale sur les manipulations de l'information https:// lnkd.in/eFJB_UP", "20180404","4","5","","", "", "BVA News"
"981539455679987712","https://twitter.com/ARouffet/status/981539455679987712","ARouffet","Sondage BVA / La villa numeris >> Réseaux sociaux et fake news , le combo idéal d'une parfaite viralité... https:// twitter.com/Lavillanumeris /status/981524413693775873 …", "20180404","0","0","","", "", "BVA News"
"981538995543986181","https://twitter.com/elestrohan/status/981538995543986181","elestrohan","Contre les fake news , les Français font confiance aux médias http:// l.leparisien.fr/s/kyVn via @LeParisien_Tech @groupe_ bva @david_lacombled", "20180404","10","0","@LeParisien_Tech @groupe_ @david_lacombled","", "", "BVA News"
"981537890210582528","https://twitter.com/ARouffet/status/981537890210582528","ARouffet","Sondage @Groupe_ BVA / @Lavillanumeris : fake news . 82% des Français estiment que les #fakenews se diffusent via les #reseauxsociaux . CQFD Qui vérifie les sources des infos avant de liker, partager, retweeter ? Peu de lecteurs... #desinformation @david_lacombled https:// twitter.com/lavillanumeris /status/981524413693775873 …", "20180404","0","0","@Groupe_ @Lavillanumeris @david_lacombled","#fakenews #reseauxsociaux #desinformation", "", "BVA News"
"981536177890189312","https://twitter.com/elestrohan/status/981536177890189312","elestrohan","Sondage Fake news @Groupe_ BVA pr La villa numéris #FakeNews 58% des Français postent sur les réseaux sociaux Mais /!\ 34% postent parfois pour susciter l’intérêt même si la source n'est pas fiable 31% postent parfois sans vérifier la source Résultats : https:// bit.ly/2uMe7S5 pic.twitter.com/83bkyPElIB", "20180404","1","1","@Groupe_","#FakeNews", "", "BVA News"
"981528836461522944","https://twitter.com/AZulfikarpasic/status/981528836461522944","AZulfikarpasic","#desinformation : 3 Français sur 4 déjà confrontés à une fausse information destinée à les influencer. Principale source de propagation des fake news : les réseaux sociaux (82%) / Sondage @Groupe_ BVA / Villa Numéris @elestrohan @david_lacombled https:// twitter.com/francediplo/st atus/981517344085348352 …", "20180404","3","4","@Groupe_ @elestrohan @david_lacombled","#desinformation", "", "BVA News"
"981232700144136192","https://twitter.com/BVA_PartnerMktg/status/981232700144136192","BVA_PartnerMktg","Exciting news for @gpen and the #GpenGIO launching with #Evolab in Colorado! https://www. prnewswire.com/news-releases/ evolab-launches-g-pen-gio-in-colorado-300622976.html …", "20180403","1","1","@gpen","#GpenGIO #Evolab", "", "BVA News"
"981169547372740608","https://twitter.com/BVA/status/981169547372740608","BVA","Nieuwe ontwikkelingen bij Youtube. This new product may be a viable option for brands that have been looking to engage more, as the platform looks to tackle fake news and enhance brand safety. http:// ow.ly/mIri30jhXmd", "20180403","0","0","","", "", "BVA News"
"989143276711182336","https://twitter.com/MrETP/status/989143276711182336","MrETP","Di più. Molto di più...non dico bloomberg ma almeno google riesci a usarlo?????", "20180425","0","0","","", "", "Bloomberg.ma"
"982045047473385473","https://twitter.com/BenMcLaughlin01/status/982045047473385473","BenMcLaughlin01","Baker McKenzie tops Bloomberg M&A League Tables for the first quarter of 2018! https://www. bakermckenzie.com/en/newsroom/20 18/04/bloomberg-ma-league-tables …", "20180405","0","3","","", "", "Bloomberg.ma"
"982026222564605952","https://twitter.com/BakersAus/status/982026222564605952","BakersAus","Baker McKenzie tops Bloomberg M&A League Tables for the first quarter of 2018 https://www. bakermckenzie.com/en/newsroom/20 18/04/bloomberg-ma-league-tables …", "20180405","2","1","","", "", "Bloomberg.ma"
"981813234431942657","https://twitter.com/bakermckenzie/status/981813234431942657","bakermckenzie","We are delighted to have topped the @business Bloomberg M&A League Tables for Q1 2018 in Australia and New Zealand, leading the field with a market share of 30.4 per cent, up 16.3 per cent from last year https:// bmcknz.ie/2uO6NFG pic.twitter.com/yizJZJ2klk", "20180405","1","5","@business","", "", "Bloomberg.ma"
"986626915179089921","https://twitter.com/Uuuna/status/986626915179089921","Uuuna","There’s a story doing the rounds that Bill Roache aka Ken Barlow of #corrie has died - not true. This story is on a website - breaking-cnn .com - which has been linked to death hoaxes before. https:// en.wikipedia.org/wiki/List_of_f ake_news_websites …", "20180418","2","3","","#corrie", "", "Breaking-CNN.com"
"986132194350522368","https://twitter.com/SmartDeminist/status/986132194350522368","SmartDeminist","No, it isn't, & that's not really CNN---it's a site intended to look like CNN. I knew it was fishy when I saw the URL--it wasn't cnn(.)com but somthing like  breaking-cnn(.)com . Utter misinformation.", "20180417","0","0","","", "", "Breaking-CNN.com"
"986073488669724672","https://twitter.com/MichelleKinney/status/986073488669724672","MichelleKinney","Barbara Bush is still alive. Breaking-CNN . com is not a real website. Until you hear substantial reports of something this horrible, please do not it w/ others. The Bush family is in my thoughts during this sad time as Mrs. Bush is in failing health.", "20180416","0","0","","", "", "Breaking-CNN.com"
"986071167738961920","https://twitter.com/MrTibbsMeow/status/986071167738961920","MrTibbsMeow","Check out the URL... breaking-cnn.com . Not CNN and Not dead.", "20180416","0","0","","", "", "Breaking-CNN.com"
"991111924187217920","https://twitter.com/Ayeameyerene/status/991111924187217920","Ayeameyerene","Something, something, blah blah, “expect everyone else to work so they don’t have to” courtesy conservative talking points 101 .", "20180430","0","0","","", "", "Conservative 101"
"991098340011073536","https://twitter.com/Artanis71/status/991098340011073536","Artanis71","Trump should thank him since his wife's family was able to come to the US with no special skills and have yet to do any work contributing to society using chain migration, conservative 101 I got mine so piss off #hypocrites", "20180430","0","0","","#hypocrites", "", "Conservative 101"
"991033561263337473","https://twitter.com/Conspiracy_101/status/991033561263337473","Conspiracy_101","I voted no because if you honestly believe the same award given to a leftist black president for absolutely no real reason could possibly be given to a conservative white pres, no matter how great a reason, in this political climate, then you're clearly delusional.", "20180430","0","0","","", "", "Conservative 101"
"990994240116285440","https://twitter.com/Stoopar/status/990994240116285440","Stoopar","FOR INFO. The present tally of peers in the House of Lords is 228 Conservative 212 Labour, 101 Liberal Democrat, 178 crossbenchers, 26 bishops and 38 from other parties. Recent vote: 335:244. CONCLUSIONS?", "20180430","0","0","","", "", "Conservative 101"
"990975815541317634","https://twitter.com/RustyInman/status/990975815541317634","RustyInman","Whaaaaaaaaaaaaaaaaaat? Every conservative should be required to take Journalism 101 /102. https:// twitter.com/NatashaBertran d/status/990915294305640448 …", "20180430","0","0","","", "", "Conservative 101"
"990966883615760385","https://twitter.com/isupportisrael_/status/990966883615760385","isupportisrael_","Are you trying to say that you're not an anti-Semite, that you're just being smeared? These are your words. Regardless of context, this is classic anti-Semitism 101 . #LabourAntisemitism pic.twitter.com/r4par4nCIS", "20180430","0","0","","#LabourAntisemitism", "", "Conservative 101"
"990760984850649088","https://twitter.com/thomasataylo/status/990760984850649088","thomasataylo","It’s called being a Conservative 101 . https:// twitter.com/rolandscahill/ status/990597028077072384 …", "20180429","0","0","","", "", "Conservative 101"
"990747398254178304","https://twitter.com/Conservative_VW/status/990747398254178304","Conservative_VW","Being Democrat 101 ... pic.twitter.com/PjpPmUoQzp", "20180429","28","61","","", "", "Conservative 101"
"990737993706156034","https://twitter.com/LeeinFbks/status/990737993706156034","LeeinFbks","I'm a Liberal Democrat Native American and I couldn't imagine turning my back on my own people by supporting a conservative http:// republican.Mr .West is a traitor, not just to his people, but to all people of color in this country.English 101 , lokk up the def. of liberal. https:// twitter.com/HuffPost/statu s/990653451905454081 …", "20180429","0","0","","", "", "Conservative 101"
"990686726690570240","https://twitter.com/oguaju1980/status/990686726690570240","oguaju1980","Conservative aggrievement 101", "20180429","0","0","","", "", "Conservative 101"
"990686310380732418","https://twitter.com/cap54/status/990686310380732418","cap54","Lesson in Conservative Hypocrisy 101 : Example A. Charlie Kirk loves his “pit bull” POTUS, loves that he’s a “fighter” and that he goes after anyone and everyone. Conversely, when the situation is flipped, Charlie runs back to mom to complain about the “meanie” libs", "20180429","0","1","","", "", "Conservative 101"
"990635213565788160","https://twitter.com/InTank4HBO/status/990635213565788160","InTank4HBO","My final instruction to you, who have obviously failed b.s. detection 101 : STOP TAKING CONSERVATIVE MEDIA AND LYING VILLAINOUS CON ARTISTS AT THEIR WORD! Jeez. All of this is so obvious to contemplative, unbiased people. Please check actual facts (not F*x) and reconsider.", "20180429","0","0","","", "", "Conservative 101"
"990602406546227201","https://twitter.com/snakebiggybigs/status/990602406546227201","snakebiggybigs","So your vile for telling the truth. Conservative whining 101", "20180429","0","0","","", "", "Conservative 101"
"990579296631775232","https://twitter.com/TomLaughalot/status/990579296631775232","TomLaughalot","No mate, rather slit my wrists than vote for a racist ultra left Russian influenced party. Conservative all the way. Trump isn’t Republican and not only screwing up America by splitting the Republican Party but screwing the world with his threats of trade wars.", "20180429","0","0","","", "", "Conservative 101"
"990408651490955266","https://twitter.com/MD_IronMan/status/990408651490955266","MD_IronMan","If a conservative person would have done this, you would have eaten em alive. Hypocrisy 101 at its finest!", "20180428","0","0","","", "", "Conservative 101"
"990352338069012480","https://twitter.com/BenBeatty2/status/990352338069012480","BenBeatty2","conservative politics 101 https:// twitter.com/kanyewest/stat us/990322711422423040 …", "20180428","1","6","","", "", "Conservative 101"
"990311397950078977","https://twitter.com/SheltieResQ/status/990311397950078977","SheltieResQ","Donate to #Senatortester for bringing a joint Republican/Dem decision forward based on complaints from 20 conservative military people and an internal report. Tester did NOTHING on his own. The only liar here is you-know-who-it-is in the WH #BlueWave", "20180428","1","17","","#Senatortester #BlueWave", "", "Conservative 101"
"990288596190965761","https://twitter.com/NathanaelNow/status/990288596190965761","NathanaelNow","Hey @AustenLionheart , thank you for this! This is the  101  book I've been seeking for my conservative peeps who don't quiiiiite know where to start. Well done! pic.twitter.com/iJ4RbmQR7o", "20180428","5","15","@AustenLionheart","", "", "Conservative 101"
"990239874832715777","https://twitter.com/Jiggly_101/status/990239874832715777","Jiggly_101","Deluded white conservative Twitter scares me. The whole thing is all support. Wtf. Such a bad Facebook fake post to just push racism even more. NICE. https:// twitter.com/andyvblue/stat us/989857865497305088 …", "20180428","0","1","","", "", "Conservative 101"
"990071705891565568","https://twitter.com/sdcazares1980/status/990071705891565568","sdcazares1980","Correct, but I already knew its reputation as a conservative -leaning site before Trump became President. They then probably realized he isn’t the guy to lead the conservative movement, only then to get ostracized as “RINO”s. Groupthink 101 .", "20180427","0","0","","", "", "Conservative 101"
"989961174274916352","https://twitter.com/Conservative_VW/status/989961174274916352","Conservative_VW","Being Globalists 101 ... pic.twitter.com/knMlZWO19r", "20180427","18","47","","", "", "Conservative 101"
"989872631250907139","https://twitter.com/philip_boyer/status/989872631250907139","philip_boyer","Saul Alinsky 101 ....dissent is intolerable.", "20180427","0","0","","", "", "Conservative 101"
"989793752985190400","https://twitter.com/KernCFC/status/989793752985190400","KernCFC","*** DUOPOLY 101 : HOW IT WORKS! *** Yep. Being telling you folks for a while and now it's out in the open. The conservative (mostly white) sector of the U.S. working... https:// medium.com/@caityjohnston e/pelosi-i-dont-see-anything-inappropriate-in-rigging-primaries-641ac1bb70c8 …", "20180427","0","0","@caityjohnston","", "", "Conservative 101"
"989702758897926144","https://twitter.com/LJBreedlove/status/989702758897926144","LJBreedlove","Ds didn’t have the votes. Do conservative Ds are freed to vote as will serve them in their states. If Shumer had the votes, these folks would have lined up and voted with the rest of the Ds. A vote you’re going to lose anyway is not the hill to die on. Politics 101 .", "20180426","5","14","","", "", "Conservative 101"
"989694166442692609","https://twitter.com/ari2020/status/989694166442692609","ari2020","Wealthy white conservative men are finally free to be themselves and advance, American history 101 .", "20180426","0","0","","", "", "Conservative 101"
"989659714802896902","https://twitter.com/CrimsonBoomer/status/989659714802896902","CrimsonBoomer","Death panels 101 as predicted by most conservative R's!!!!", "20180426","0","0","","", "", "Conservative 101"
"989624240726073344","https://twitter.com/wvwllw/status/989624240726073344","wvwllw","This guy is freaking amazing. Started the game throwing 98 6th inning threw conservative pitches at 101 .", "20180426","0","0","","", "", "Conservative 101"
"989594084582019073","https://twitter.com/strollo5/status/989594084582019073","strollo5","You can't POSSIBLY understand the plight of the black man AND have any kind of wealth. Conservative logic 101 . That, and they're morons.", "20180426","0","1","","", "", "Conservative 101"
"989575740197752832","https://twitter.com/101_derek/status/989575740197752832","101_derek","Liberals think the word terrorist is a synonym for middle eastern in the conservative thesaurus. https:// twitter.com/sunlorrie/stat us/989471002458374145 …", "20180426","0","0","","", "", "Conservative 101"
"989548859469848576","https://twitter.com/ispeakpineapple/status/989548859469848576","ispeakpineapple","I find it ironic that you claim to be a libertarian...I would call myself classical liberal (fiscally conservative , socially liberal)...but only one of us arguing for total personal autonomy, responsibility, choice, and control over ones body...John Locke 101 ...", "20180426","0","0","","", "", "Conservative 101"
"989545614336843777","https://twitter.com/WWMamaDo/status/989545614336843777","WWMamaDo","Kelly Ann Conway is being asked what her husband’s tweets against President Trump mean about her loyalty. We have a strong, conservative woman thinking differently from her husband, and CNN nails her for it? We'll talk about this tonight, 6-7 PM on 101 .7 FM/710 AM. @710keel pic.twitter.com/2rb1czTnzj", "20180426","0","0","@710keel","", "", "Conservative 101"
"989545480618233857","https://twitter.com/american_ground/status/989545480618233857","american_ground","Kelly Ann Conway is being asked what her husband’s tweets against President Trump mean about her loyalty. We have a strong, conservative woman thinking differently from her husband, and CNN nails her for it? We'll talk about this tonight, 6-7 PM on 101 .7 FM/710 AM. @710keel pic.twitter.com/16UhDMkgR3", "20180426","0","0","@710keel","", "", "Conservative 101"
"989486815210962945","https://twitter.com/Findingourself/status/989486815210962945","Findingourself",". @onpoli @fordnation @Kathleen_Wynne @AndreaHorwath @cdnpoli No need...real world has proven truer - econ 101 - lol ...do not need....but remember who makes these claims.....! But thanks for you very conservative viewpoint :)", "20180426","0","0","@onpoli @fordnation @Kathleen_Wynne @AndreaHorwath @cdnpoli","", "", "Conservative 101"
"989372803047620608","https://twitter.com/Bourbon_Dem/status/989372803047620608","Bourbon_Dem","Uh, it’s actually not meaningless. Republican Presidents tend to nominate conservative judges - US politics 101 . And it’s relevant here to show this isn’t someone with a liberal agenda.", "20180426","0","0","","", "", "Conservative 101"
"989319049048936448","https://twitter.com/ugottasec/status/989319049048936448","ugottasec","Best way for any person or product to get HUGE publicity is to SUPPORT Pres. Trump and Conservative values, no? Good or bad that's capitalism 101 @kanyewest @therealroseanne @FloydMayweather", "20180425","0","0","@kanyewest @therealroseanne @FloydMayweather","", "", "Conservative 101"
"989314434542731266","https://twitter.com/PGYOMikey/status/989314434542731266","PGYOMikey","The biggest #redpill for #hollyweird is that conservative fans and supporters are the best ones to have. #wehavejobs ! Lesson 101 - Don’t mix business and politics dumb ’s", "20180425","0","0","","#redpill #hollyweird #wehavejobs", "", "Conservative 101"
"989247225120395266","https://twitter.com/JoeBobMr/status/989247225120395266","JoeBobMr","Economic REALiTY 101 =the Most #Conservative President since the Civil War was #CalvinCoolidge & He CUT GOVT SPENDING by 25% & the ECONOMY TOOK OFF like a ROCKET! Spending was WAY TOO HIGH then Same as NOW. Japan has PROVED #REinflation theory is NOT valid with High #NationaDebt", "20180425","0","1","","#Conservative #CalvinCoolidge #REinflation #NationaDebt", "", "Conservative 101"
"989203823821455361","https://twitter.com/NateBell4AR/status/989203823821455361","NateBell4AR","Dear @JanMorgan_ Broad base-low rates Conservative tax policy 101 Eliminating special interest loopholes and lowering overall rates IS conservative tax reform. Tax Reform Task Force is DOING what you can only talk about in generalities.", "20180425","3","3","@JanMorgan_","", "", "Conservative 101"
"989198809073827840","https://twitter.com/Conservative_VW/status/989198809073827840","Conservative_VW","Being Democrat 101 .... pic.twitter.com/HCaa95g2NW", "20180425","39","58","","", "", "Conservative 101"
"989198009341751298","https://twitter.com/BCollier2012/status/989198009341751298","BCollier2012","I'm sure Theresa May is a compassionate Conservative and a good Christian, but I wouldn't let her anywhere near my 101 Dalmatians #Windrush #pmqs #bbcnews #C4News", "20180425","2","1","","#Windrush #pmqs #bbcnews #C4News", "", "Conservative 101"
"989174208214196224","https://twitter.com/Conservative_VW/status/989174208214196224","Conservative_VW","Being Democrat 101 ... pic.twitter.com/f0IN2grCkL", "20180425","26","35","","", "", "Conservative 101"
"989130297387044864","https://twitter.com/BlueRP112617/status/989130297387044864","BlueRP112617","Panay post ng unflattering bikini pics #Conservative101", "20180425","0","4","","#Conservative101", "", "Conservative 101"
"989129314804236288","https://twitter.com/Babaylan_IDA/status/989129314804236288","Babaylan_IDA","inuumaga kasama ang lalaki #Conservative101", "20180425","0","5","","#Conservative101", "", "Conservative 101"
"989106126410141703","https://twitter.com/drillanwr/status/989106126410141703","drillanwr","And so, amid the mounds of bizarre things he's said and done over the years his positive comment regarding a black female conservative using her freedom of thought/speech and his favorable attitude towards POTUS NOW means he's mentally vexed and possibly needs Orwell's Room 101 https:// twitter.com/people/status/ 988946399747338240 …", "20180425","0","0","","", "", "Conservative 101"
"988942964733997057","https://twitter.com/FateInThyself/status/988942964733997057","FateInThyself","Conservative wokeness 101 https:// twitter.com/CurtisHouck/st atus/988940968362758144 …", "20180424","0","0","","", "", "Conservative 101"
