id,url,account,text,date,retweet,favorite,mentioned,hashtags,geotags,keyword
"981730566566498306","https://twitter.com/sweepnwin/status/981730566566498306","sweepnwin","Warning: Google's Chrome Browser Secretly Scans All Files On Your PC https://www. disclose.tv/warning-google s-chrome-browser-secretly-scans-all-files-on-your-pc-329852 … via @DiscloseTV #technology", "20180404","0","0","@DiscloseTV","#technology", "", "Disclose TV"
"981666392930955264","https://twitter.com/Acemansworld/status/981666392930955264","Acemansworld","More like a brown hole.", "20180404","0","0","","", "", "Disclose TV"
"981663447535546368","https://twitter.com/tekwrek/status/981663447535546368","tekwrek","Shocking 1995 Video Surfaces Of Barack Obama Revealing Who He REALLY Is https://www. disclose.tv/shocking-1995- video-surfaces-of-barack-obama-revealing-who-he-really-is-309970 … via @DiscloseTV #politics", "20180404","8","5","@DiscloseTV","#politics", "", "Disclose TV"
"981662138631467009","https://twitter.com/thomasdolson/status/981662138631467009","thomasdolson","https://www. truthorfiction.com/ancient-army-f ound/ … Please note, this is not scopes, but truthorfiction!", "20180404","0","0","","", "", "Disclose TV"
"981648971780288513","https://twitter.com/skunkwirks/status/981648971780288513","skunkwirks","Massive Car Graveyard Where VW Diesel Vehicles Go To Die | http:// Disclose.tv https://www. disclose.tv/massive-car-gr aveyard-where-vw-diesel-vehicles-go-to-die-329690?utm_source=newsletter&utm_medium=mail&utm_campaign=disclose_daily_04_04_2018 … via @DiscloseTV #technology", "20180404","0","0","@DiscloseTV","#technology", "", "Disclose TV"
"981638872378552322","https://twitter.com/terapeuticaholi/status/981638872378552322","terapeuticaholi","If You’re Still Alive In 30 Years, You Might Live To Be 1,000 Years Old | http:// Disclose.tv https://www. disclose.tv/if-youre-still -alive-in-30-years-you-might-live-to-be-1000-years-old-319557 … via @DiscloseTV #health", "20180404","0","0","@DiscloseTV","#health", "", "Disclose TV"
"981630476308897792","https://twitter.com/duane_swaby/status/981630476308897792","duane_swaby","Warning: Google's Chrome Browser Secretly Scans All Files On Your PC https://www. disclose.tv/warning-google s-chrome-browser-secretly-scans-all-files-on-your-pc-329852 … via @DiscloseTV #technology", "20180404","0","0","@DiscloseTV","#technology", "", "Disclose TV"
"981627903405428736","https://twitter.com/NiceGuy504/status/981627903405428736","NiceGuy504","Two Levitated Cars Caught On Video https://www. disclose.tv/two-levitated- cars-caught-on-video-329888 … via @DiscloseTV #mystery", "20180404","0","0","@DiscloseTV","#mystery", "", "Disclose TV"
"981618868606119936","https://twitter.com/NWFCyber/status/981618868606119936","NWFCyber","Warning: Google's Chrome Browser Secretly Scans All Files On Your PC https://www. disclose.tv/warning-google s-chrome-browser-secretly-scans-all-files-on-your-pc-329852 … via @DiscloseTV #technology", "20180404","0","0","@DiscloseTV","#technology", "", "Disclose TV"
"981585084057882625","https://twitter.com/janebinnion/status/981585084057882625","janebinnion","I know I shouldn't laugh but... Scuba Diver Is Hospitalized After He Tried Having Sex With A Giant Clam. https://www. disclose.tv/scuba-diver-is -hospitalized-after-he-tried-having-sex-with-a-giant-clam-329243 … via @DiscloseTV #offtopic", "20180404","0","0","@DiscloseTV","#offtopic", "", "Disclose TV"
"981582428866338817","https://twitter.com/ImkenmacMaclean/status/981582428866338817","ImkenmacMaclean","Why You Should Never, Ever Cut Your Hair https://www. disclose.tv/why-you-should -never-ever-cut-your-hair-329714?utm_source=newsletter&utm_medium=mail&utm_campaign=disclose_daily_04_04_2018 … via @DiscloseTV #spiritual", "20180404","0","0","@DiscloseTV","#spiritual", "", "Disclose TV"
"981577896220340226","https://twitter.com/disclosetv/status/981577896220340226","disclosetv","Interesting! https://www. disclose.tv/confirmed-bird s-can-see-earths-magnetic-fields-and-here-is-how-329807 …", "20180404","21","20","","", "", "Disclose TV"
"981574949633773568","https://twitter.com/_StephenRiley_/status/981574949633773568","_StephenRiley_","Warning: Google's Chrome Browser Secretly Scans All Files On Your PC https://www. disclose.tv/warning-google s-chrome-browser-secretly-scans-all-files-on-your-pc-329852 … via @DiscloseTV #technology #chrome #windows", "20180404","0","0","@DiscloseTV","#technology #chrome #windows", "", "Disclose TV"
"981564049719640066","https://twitter.com/sanjeevkumarmba/status/981564049719640066","sanjeevkumarmba","Guru ji can you disclose on your monetary terms with this TV channel Group ??? You have been brave analyst so hope u take this as positive query!!", "20180404","0","1","","", "", "Disclose TV"
"981552773220192257","https://twitter.com/NiceGuy504/status/981552773220192257","NiceGuy504","Warning: Google's Chrome Browser Secretly Scans All Files On Your PC https://www. disclose.tv/warning-google s-chrome-browser-secretly-scans-all-files-on-your-pc-329852 … via @DiscloseTV #technology", "20180404","0","0","@DiscloseTV","#technology", "", "Disclose TV"
"981552649672839168","https://twitter.com/NiceGuy504/status/981552649672839168","NiceGuy504","Sky Snakes, Sky Serpents, More Evidence, March 2018 https://www. disclose.tv/sky-snakes-sky -serpents-more-evidence-march-2018-329846 … via @DiscloseTV #ufos", "20180404","0","1","@DiscloseTV","#ufos", "", "Disclose TV"
"981552467249909760","https://twitter.com/NiceGuy504/status/981552467249909760","NiceGuy504","A Former Researcher At USGS Warn Humanity Of The Danger Of Planet X https://www. disclose.tv/a-former-resea rcher-at-usgs-warn-humanity-of-the-danger-of-planet-x-329753 … via @DiscloseTV #space", "20180404","0","0","@DiscloseTV","#space", "", "Disclose TV"
"981552322982576128","https://twitter.com/NiceGuy504/status/981552322982576128","NiceGuy504","THEY LIVE Is A Documentary, Here Is The Proof https://www. disclose.tv/they-live-is-a -documentary-here-is-the-proof-329816 … via @DiscloseTV #conspiracy", "20180404","0","1","@DiscloseTV","#conspiracy", "", "Disclose TV"
"981549173752377344","https://twitter.com/TRUTHSEEKER0002/status/981549173752377344","TRUTHSEEKER0002","only porn hub files", "20180404","0","0","","", "", "Disclose TV"
"981539983403208704","https://twitter.com/uk_ufology/status/981539983403208704","uk_ufology","Witnessed The Supposed ABDUCTION Of A Cow In Puerto Gaboto, Argentina. https://www. disclose.tv/witnessed-the- supposed-abduction-of-a-cow-in-puerto-gaboto-argentina-329840 … via @DiscloseTV #aliens", "20180404","0","0","@DiscloseTV","#aliens", "", "Disclose TV"
"981539865589440512","https://twitter.com/uk_ufology/status/981539865589440512","uk_ufology","UFO'S Over Finland April 1st https://www. disclose.tv/ufos-over-finl and-april-1st-329843 … via @DiscloseTV #ufos", "20180404","0","0","@DiscloseTV","#ufos", "", "Disclose TV"
"981539716842573824","https://twitter.com/uk_ufology/status/981539716842573824","uk_ufology","Sky Snakes, Sky Serpents, More Evidence, March 2018 https://www. disclose.tv/sky-snakes-sky -serpents-more-evidence-march-2018-329846 … via @DiscloseTV #ufos", "20180404","0","0","@DiscloseTV","#ufos", "", "Disclose TV"
"981528984386265088","https://twitter.com/disclosetv/status/981528984386265088","disclosetv","Have Chrome installed...? https://www. disclose.tv/warning-google s-chrome-browser-secretly-scans-all-files-on-your-pc-329852 …", "20180404","4","4","","", "", "Disclose TV"
"981516236474347521","https://twitter.com/Widhi_Nugroho83/status/981516236474347521","Widhi_Nugroho83","Indonesian Oma", "20180404","0","0","","", "", "Disclose TV"
"981511726301622273","https://twitter.com/disclosetv/status/981511726301622273","disclosetv","http://www. disclose.tv pic.twitter.com/SxrdvyneJ1", "20180404","10","63","","", "", "Disclose TV"
"981509775807668224","https://twitter.com/disclosetv/status/981509775807668224","disclosetv","What?! https://www. disclose.tv/bizarre-report s-of-zombie-raccoons-have-ohio-city-on-edge-329801 …", "20180404","4","7","","", "", "Disclose TV"
"981482998276136962","https://twitter.com/AnthonyJGriffin/status/981482998276136962","AnthonyJGriffin","Why You Should Never, Ever Cut Your Hair https://www. disclose.tv/why-you-should -never-ever-cut-your-hair-329714 … via @DiscloseTV #spiritual", "20180404","0","0","@DiscloseTV","#spiritual", "", "Disclose TV"
"981456227812216832","https://twitter.com/disclosetv/status/981456227812216832","disclosetv","http://www. disclose.tv pic.twitter.com/m6cdcNukuR", "20180404","6","22","","", "", "Disclose TV"
"981448649132642304","https://twitter.com/Salman_Zafr/status/981448649132642304","Salman_Zafr","2 Commercial Pilots Say They Saw UFO While Flying Over Arizona; Audio Released https://www. disclose.tv/2-commercial-p ilots-say-they-saw-ufo-while-flying-over-arizona-audio-released-329390 … via @DiscloseTV #ufos", "20180404","0","0","@DiscloseTV","#ufos", "", "Disclose TV"
"981413447282905089","https://twitter.com/spaceoflove07/status/981413447282905089","spaceoflove07","NASA Confession: American Citizens Are Being Dosed With Lithium And Other Chemicals By Air | http:// Disclose.tv https://www. disclose.tv/nasa-confessio n-american-citizens-are-being-dosed-with-lithium-and-other-chemicals-by-air-329447 … via @DiscloseTV #health", "20180404","0","0","@DiscloseTV","#health", "", "Disclose TV"
"981368184375775233","https://twitter.com/New_Narrative/status/981368184375775233","New_Narrative","Trump calls the major TV networks fakers, praises Sinclair Broadcasting Group, a right-leaning company previously fined for failing to disclose paid programming: https:// twitter.com/ap_politics/st atus/981204340915437568 …", "20180403","13","10","","", "", "Disclose TV"
"981349903271170048","https://twitter.com/_PleaseNote/status/981349903271170048","_PleaseNote","NASA Satellite Pictures Prove Our Weather Is Manipulated https://www. disclose.tv/nasa-satellite -pictures-prove-our-weather-is-manipulated-314989 … via @DiscloseTV #nature", "20180403","0","0","@DiscloseTV","#nature", "", "Disclose TV"
"981338317575909376","https://twitter.com/jamesmpope/status/981338317575909376","jamesmpope","So your son works works for @EPAScottPruitt and you get on national TV defending this swamp rat - did @SRuhle disclose that you have a huge conflict of interest in reporting on Pruitt? What’s up with @MSNBC", "20180403","0","1","@EPAScottPruitt @SRuhle @MSNBC","", "", "Disclose TV"
"981310256180494337","https://twitter.com/TxUFOSightings/status/981310256180494337","TxUFOSightings","#truth", "20180403","0","0","","#truth", "", "Disclose TV"
"981293803930832896","https://twitter.com/Svedka27/status/981293803930832896","Svedka27","Website That Predicted Rockefeller Death In 2017 Has Grim 2018 Predictions https://www. disclose.tv/website-that-p redicted-rockefeller-death-in-2017-has-grim-2018-predictions-318667 … via @DiscloseTV #prophecy", "20180403","0","0","@DiscloseTV","#prophecy", "", "Disclose TV"
"981278453101203456","https://twitter.com/1shawnster/status/981278453101203456","1shawnster","Per Fox : the woman has been reported on is incapacitated and shot her boyfriend ??", "20180403","1","1","","", "", "Disclose TV"
"981275010718486528","https://twitter.com/1shawnster/status/981275010718486528","1shawnster","Multiple patients arriving at two San francisco Hospitals..", "20180403","1","1","","", "", "Disclose TV"
"981267015607422977","https://twitter.com/1shawnster/status/981267015607422977","1shawnster","Active Shooter Reported At YouTube Headquarters https://www. disclose.tv/active-shooter -reported-at-youtube-headquarters-police-say-329759 … via @DiscloseTV #worldnews", "20180403","3","3","@DiscloseTV","#worldnews", "", "Disclose TV"
"981266907243405313","https://twitter.com/MARKNAIDOO1/status/981266907243405313","MARKNAIDOO1","No more videos???", "20180403","0","0","","", "", "Disclose TV"
"981266606079782914","https://twitter.com/disclosetv/status/981266606079782914","disclosetv","JUST IN: YouTube headquarters 'locked down amid reports of active shooter' https://www. disclose.tv/active-shooter -reported-at-youtube-headquarters-police-say-329759 …", "20180403","6","5","","", "", "Disclose TV"
"981245216752578561","https://twitter.com/disclosetv/status/981245216752578561","disclosetv","http://www. disclose.tv pic.twitter.com/RGPZwi7iAt", "20180403","7","9","","", "", "Disclose TV"
"981233117154430977","https://twitter.com/disclosetv/status/981233117154430977","disclosetv","OMG https://www. disclose.tv/massive-car-gr aveyard-where-vw-diesel-vehicles-go-to-die-329690 … #VW", "20180403","2","4","","#VW", "", "Disclose TV"
"981217569750306823","https://twitter.com/PharoahMessiah/status/981217569750306823","PharoahMessiah","What??? What do mean.", "20180403","0","0","","", "", "Disclose TV"
"981215526528671744","https://twitter.com/disclosetv/status/981215526528671744","disclosetv","http://www. disclose.tv pic.twitter.com/P5WKljZyCI", "20180403","6","10","","", "", "Disclose TV"
"981210181349642240","https://twitter.com/duane_swaby/status/981210181349642240","duane_swaby","Ex-Illuminati Member Leaked The Current Membership Of The 'Committee Of 300' https://www. disclose.tv/ex-illuminati- member-leaked-the-current-membership-of-the-committee-of-300-314385 … via @DiscloseTV #conspiracy", "20180403","0","0","@DiscloseTV","#conspiracy", "", "Disclose TV"
"981205447406432257","https://twitter.com/disclosetv/status/981205447406432257","disclosetv","This footage has emerged of the moment a veteran pilot captured two UFOs passing in front of his private aircraft. https://www. disclose.tv/argentinian-pi lot-stunned-as-two-flying-saucer-ufos-pass-329717 …", "20180403","9","13","","", "", "Disclose TV"
"981204340915437568","https://twitter.com/AP_Politics/status/981204340915437568","AP_Politics","Trump calls the major TV networks fakers, praises Sinclair Broadcasting Group, a right-leaning company previously fined for failing to disclose paid programming: http:// apne.ws/WKGH25r", "20180403","94","96","","", "", "Disclose TV"
"981198053808975873","https://twitter.com/TheDroningPool/status/981198053808975873","TheDroningPool","Can’t get a job at the WH without a NDA swearing not to disclose your misdeeds. Can’t talk about your TV counselors and advisors. Can’t talk about your illicit sex perversions. Some people are saying you took that bunny home with you. Is that weird or what?", "20180403","0","1","","", "", "Disclose TV"
"981189397704921088","https://twitter.com/AAPSonline/status/981189397704921088","AAPSonline","The real problem is that there are no economic incentives for the health care industry to disclose its prices in the first place. ... Federal agencies don’t need to mandate that Best Buy list the price of the TVs it wants to sell you. https://www. forbes.com/sites/theapoth ecary/2018/03/26/trumps-health-secretary-wants-to-transform-healthcare-can-he/#6ed20005284c …", "20180403","6","10","","#6ed20005284c", "", "Disclose TV"
"981155156845834240","https://twitter.com/NiceGuy504/status/981155156845834240","NiceGuy504","CAN YOU SAY @NASA WE HAVE A PROBLEM? Man On The Moon....but Not In A Space Suit??? https://www. disclose.tv/man-on-the-moo nbut-not-in-a-space-suit-329636 … via @DiscloseTV #ufos", "20180403","0","0","@NASA @DiscloseTV","#ufos", "", "Disclose TV"
"981154945943695362","https://twitter.com/NiceGuy504/status/981154945943695362","NiceGuy504","First Tide Pods... Now The Morons Snort Condoms On Social Media https://www. disclose.tv/first-tide-pod s-now-the-morons-snort-condoms-on-social-media-329693 … via @DiscloseTV #society", "20180403","0","0","@DiscloseTV","#society", "", "Disclose TV"
"981149318206894082","https://twitter.com/disclosetv/status/981149318206894082","disclosetv","Did you know? Here is why... https://www. disclose.tv/why-you-should -never-ever-cut-your-hair-329714 …", "20180403","0","0","","", "", "Disclose TV"
"981142219762618368","https://twitter.com/CryptoUK/status/981142219762618368","CryptoUK","Scientists Once Secretly Created A Human-chimpanzee Hybrid, A Highly Respected Evolutionary Biologist Claims https://www. disclose.tv/scientists-onc e-secretly-created-a-human-chimpanzee-hybrid-a-highly-respected-evolutionary-biologist-321501 … via @DiscloseTV #cryptozoology", "20180403","0","0","@DiscloseTV","#cryptozoology", "", "Disclose TV"
"981135675453034496","https://twitter.com/PharoahMessiah/status/981135675453034496","PharoahMessiah","Religion the practice of training your mind to ignore evidence,logic and reason. Religion teaches you not to question in church and also the bible. It's sad but that's the truth of reality. pic.twitter.com/JHRJVrtvtM", "20180403","0","2","","", "", "Disclose TV"
"981131010447433730","https://twitter.com/Ducksess/status/981131010447433730","Ducksess","Religion is the biggest killer of all time.", "20180403","0","0","","", "", "Disclose TV"
"981130620666630145","https://twitter.com/disclosetv/status/981130620666630145","disclosetv","pic.twitter.com/6XltupCASs", "20180403","36","57","","", "", "Disclose TV"
"981116626845102081","https://twitter.com/RobbiePIII/status/981116626845102081","RobbiePIII","I bet they all want more strict gun laws too.", "20180403","0","0","","", "", "Disclose TV"
"981109859046305792","https://twitter.com/disclosetv/status/981109859046305792","disclosetv","What will they come up next with?! https://www. disclose.tv/first-tide-pod s-now-the-morons-snort-condoms-on-social-media-329693 …", "20180403","1","1","","", "", "Disclose TV"
"981060975938887680","https://twitter.com/ecuador_travels/status/981060975938887680","ecuador_travels","Ecuador: Moreno Disclose Program to Boost Economy - teleSUR tv HTTPS (press release) (blog) http:// dlvr.it/QNF9cT", "20180403","0","0","","", "", "Disclose TV"
"981060252387958784","https://twitter.com/uk_ufology/status/981060252387958784","uk_ufology","Compilation UFO's In IRAN | http:// Disclose.tv https://www. disclose.tv/compilation-uf os-in-iran-329669 … via @DiscloseTV #ufos", "20180403","0","0","@DiscloseTV","#ufos", "", "Disclose TV"
"981060115498524672","https://twitter.com/uk_ufology/status/981060115498524672","uk_ufology","UFO Very Luminous Orb Filmed In Finland On April 1 , 2018 By A Security Camera | http:// Disclose.tv https://www. disclose.tv/ufo-very-lumin ous-orb-filmed-in-finland-on-april-1-2018-by-a-security-camera-329675 … via @DiscloseTV #ufos", "20180403","0","0","@DiscloseTV","#ufos", "", "Disclose TV"
"981022735546703872","https://twitter.com/ETaivas/status/981022735546703872","ETaivas","According to Kalegri, a diverse and multi-cultural people were easy to control as they had no common identity to rally behind in the event of a political crisis. #EUSSR https://www. disclose.tv/the-kalergi-pl an-the-real-reason-that-the-european-union-is-so-hostile-to-donald-trump-311329 … via @DiscloseTV #history", "20180403","1","3","@DiscloseTV","#EUSSR #history", "", "Disclose TV"
"980987399403724800","https://twitter.com/NiceGuy504/status/980987399403724800","NiceGuy504","SERPENTS OWN THE RED CROSS! The Red Cross Has Built Exactly 6 Homes In Haiti With 500 Billion Dollars In Donations http:// disclose.tv/the-red-cross- … via @DiscloseTV #conspiracy", "20180402","0","0","@DiscloseTV","#conspiracy", "", "Disclose TV"
"980985423844569088","https://twitter.com/NiceGuy504/status/980985423844569088","NiceGuy504","SEE A SERPENT! George Bush Senior Slips Up And Laughs At The Assassination Of JFK https://www. disclose.tv/george-bush-se nior-slips-up-and-laughs-at-the-assassination-of-jfk-329633 … via @DiscloseTV #conspiracy", "20180402","0","1","@DiscloseTV","#conspiracy", "", "Disclose TV"
"980985252255498240","https://twitter.com/NiceGuy504/status/980985252255498240","NiceGuy504","THEY GUARD THIS 24/7! The Size Of Polar Openings To Inner Earth https://www. disclose.tv/the-size-of-po lar-openings-to-inner-earth-329630 … via @DiscloseTV #mystery", "20180402","0","0","@DiscloseTV","#mystery", "", "Disclose TV"
"980951243723083776","https://twitter.com/lesleysfarm/status/980951243723083776","lesleysfarm","Church Leader Mauled By Lion After Trying To Prove God Would Intervene https://www. disclose.tv/church-leader- mauled-by-lion-after-trying-to-prove-god-would-intervene-329108 … via @DiscloseTV #society", "20180402","0","0","@DiscloseTV","#society", "", "Disclose TV"
"980937778228809728","https://twitter.com/the_uncanny13/status/980937778228809728","the_uncanny13","Lol...sheeple!", "20180402","0","0","","", "", "Disclose TV"
"980909437916532742","https://twitter.com/Niall_M_Delaney/status/980909437916532742","Niall_M_Delaney","They're just crusing down the river of life Man.. taking it real mellow like.. If you catch my drift", "20180402","0","0","","", "", "Disclose TV"
"980889265239412736","https://twitter.com/disclosetv/status/980889265239412736","disclosetv","https://www. disclose.tv/george-bush-se nior-slips-up-and-laughs-at-the-assassination-of-jfk-329633 …", "20180402","1","1","","", "", "Disclose TV"
"980879908648996866","https://twitter.com/Toba_60/status/980879908648996866","Toba_60","George Bush Senior Slips Up And Laughs At The Assassination Of JFK https://www. disclose.tv/george-bush-se nior-slips-up-and-laughs-at-the-assassination-of-jfk-329633 … via @DiscloseTV #conspiracy", "20180402","0","0","@DiscloseTV","#conspiracy", "", "Disclose TV"
"980879704436756481","https://twitter.com/Toba_60/status/980879704436756481","Toba_60","Astroturf And Media Manipulation https://www. disclose.tv/astroturf-and- media-manipulation-316122 … via @DiscloseTV #conspiracy", "20180402","0","0","@DiscloseTV","#conspiracy", "", "Disclose TV"
"980860383144620032","https://twitter.com/Pussilicca/status/980860383144620032","Pussilicca","Entrance To Hollow Earth In Antarctica Found By The French Association Of Astronomy https://www. disclose.tv/entrance-to-ho llow-earth-in-antarctica-found-by-the-french-association-of-astronomy-329564?utm_source=newsletter&utm_medium=mail&utm_campaign=disclose_daily_04_02_2018 … via @DiscloseTV #mystery", "20180402","0","0","@DiscloseTV","#mystery", "", "Disclose TV"
"980840536448880642","https://twitter.com/disclosetv/status/980840536448880642","disclosetv","Creepy as f**** https://www. disclose.tv/german-company -develops-creepy-rolling-spider-bot-329534 …", "20180402","3","4","","", "", "Disclose TV"
"980835001125269508","https://twitter.com/disclosetv/status/980835001125269508","disclosetv","pic.twitter.com/hOLxuqdTqJ", "20180402","21","32","","", "", "Disclose TV"
"980818468797902848","https://twitter.com/Baron_AMMassa/status/980818468797902848","Baron_AMMassa","Scuba Diver Is Hospitalized After He Tried Having Sex With A Giant Clam https://www. disclose.tv/scuba-diver-is -hospitalized-after-he-tried-having-sex-with-a-giant-clam-329243 … via @DiscloseTV #offtopic", "20180402","0","1","@DiscloseTV","#offtopic", "", "Disclose TV"
"980797523731402758","https://twitter.com/Twoyorkie/status/980797523731402758","Twoyorkie","Scuba Diver Is Hospitalized After He Tried Having Sex With A Giant Clam | http:// Disclose.tv https://www. disclose.tv/scuba-diver-is -hospitalized-after-he-tried-having-sex-with-a-giant-clam-329243 … via @DiscloseTV #offtopic", "20180402","1","1","@DiscloseTV","#offtopic", "", "Disclose TV"
"980765288265322496","https://twitter.com/disclosetv/status/980765288265322496","disclosetv","Will meets Sophia (VIDEO) https://www. disclose.tv/will-smiths-aw kward-date-with-sophia-the-robot-329615 …", "20180402","0","1","","", "", "Disclose TV"
"980755572948701184","https://twitter.com/CryptoUK/status/980755572948701184","CryptoUK","Bizarre ‘Square Clouds'? Geoengineering Is No Joke! https://www. disclose.tv/bizarre-square -clouds-geoengineering-is-no-joke-329531 … via @DiscloseTV #conspiracy", "20180402","0","0","@DiscloseTV","#conspiracy", "", "Disclose TV"
"980685259879493633","https://twitter.com/AudraDoesIt/status/980685259879493633","AudraDoesIt","#WatchLive The #China #SpaceStation Reentry East Of #SouthAmerica http:// Disclose.tv https://www. disclose.tv/watch-live-the -china-space-station-reentry-east-of-south-america-in-20-minutes-329597 … via @DiscloseTV #space", "20180402","0","0","@DiscloseTV","#WatchLive #China #SpaceStation #SouthAmerica #space", "", "Disclose TV"
"980654379878383617","https://twitter.com/Cal_Para/status/980654379878383617","Cal_Para","Rapper Gets Chased By Guy Running With Superhuman Speed: Human or NonHuman? You decide. | http:// Disclose.tv https://www. disclose.tv/rapper-gets-ch ased-by-guy-running-with-superhuman-speed-329144 … via @DiscloseTV #paranormal", "20180401","0","0","@DiscloseTV","#paranormal", "", "Disclose TV"
"980652783400509440","https://twitter.com/Cal_Para/status/980652783400509440","Cal_Para","Mass Phenomena: PHONE CALLS From People Who Have Died! | http:// Disclose.tv https://www. disclose.tv/mass-phenomena -phone-calls-from-people-who-have-died-329300 … via @DiscloseTV #paranormal", "20180401","0","0","@DiscloseTV","#paranormal", "", "Disclose TV"
"980652537660370946","https://twitter.com/Cal_Para/status/980652537660370946","Cal_Para","The Hooded Ones | Freak Lore | http:// Disclose.tv https://www. disclose.tv/the-hooded-one s-freak-lore-326804 … via @DiscloseTV #paranormal", "20180401","0","0","@DiscloseTV","#paranormal", "", "Disclose TV"
"980652438729338881","https://twitter.com/Cal_Para/status/980652438729338881","Cal_Para","Encounters Of The Mantis Men | Freak Lore | http:// Disclose.tv https://www. disclose.tv/encounters-of- the-mantis-men-freak-lore-327869 … via @DiscloseTV", "20180401","0","0","@DiscloseTV","", "", "Disclose TV"
