id,url,account,text,date,retweet,favorite,mentioned,hashtags,geotags,keyword
"987658873661214721","https://twitter.com/HJStr4ngel0ve/status/987658873661214721","HJStr4ngel0ve","Ph.D. Student Used Her Vagina To Make Yogurt https://www. disclose.tv/phd-student-us ed-her-vagina-to-make-yogurt-331629 … via @DiscloseTV #science", "20180421","0","0","@DiscloseTV","#science", "", "Disclose TV"
"987647944944963584","https://twitter.com/RichardGarofalo/status/987647944944963584","RichardGarofalo","You mean the same Sean Spencer who lied about the crowd size at inauguration is going on tv to talk to a guy who failed to disclose his relationship with Cohen? Let me see... watch paint dry or watch Hannity?", "20180421","0","0","","", "", "Disclose TV"
"987642121527099392","https://twitter.com/EastEndShout/status/987642121527099392","EastEndShout","How Rockefeller Found Big Pharma And Destroyed Natural Cures https://www. disclose.tv/how-rockefelle r-found-big-pharma-and-destroyed-natural-cures-331632 … via @DiscloseTV #health", "20180421","0","0","@DiscloseTV","#health", "", "Disclose TV"
"987610386030477312","https://twitter.com/TimDYoungBSMPA5/status/987610386030477312","TimDYoungBSMPA5","So glad I found your Twitter account to follow.", "20180421","0","0","","", "", "Disclose TV"
"987606836080709634","https://twitter.com/NiceGuy504/status/987606836080709634","NiceGuy504","Reptilian Jesus Fiery Flying Serpent Uncovered In Vatican https://www. disclose.tv/reptilian-jesu s-fiery-flying-serpent-uncovered-in-vatican-331686 … via @DiscloseTV #aliens", "20180421","1","2","@DiscloseTV","#aliens", "", "Disclose TV"
"987603223937732608","https://twitter.com/Diaptera_80/status/987603223937732608","Diaptera_80","That is just like making yoghurt in your mouth.", "20180421","0","0","","", "", "Disclose TV"
"987598063459078146","https://twitter.com/blimey50505/status/987598063459078146","blimey50505","Her mum and dad must be so proud", "20180421","0","1","","", "", "Disclose TV"
"987594397012328448","https://twitter.com/JCAM_01/status/987594397012328448","JCAM_01","Yummmm...chunky", "20180421","0","0","","", "", "Disclose TV"
"987591734338248705","https://twitter.com/disclosetv/status/987591734338248705","disclosetv","Thoughts? https://www. disclose.tv/phd-student-us ed-her-vagina-to-make-yogurt-331629 …", "20180421","4","3","","", "", "Disclose TV"
"987572488912625664","https://twitter.com/tsurumaru1889/status/987572488912625664","tsurumaru1889","This Is Probably The Best 9/11 Video You'll Ever See https://www. disclose.tv/this-is-probab ly-the-best-911-video-youll-ever-see-308203 … via @DiscloseTV #politics", "20180421","0","0","@DiscloseTV","#politics", "", "Disclose TV"
"987503568423878656","https://twitter.com/The_Artist_Wolf/status/987503568423878656","The_Artist_Wolf","WOW... the most trusted names in n.... Uh wait... no they're not. Let's start with Spicer & crowd size on day 1. The rest? Their coverage of Trump is state TV . No matter what you broadcast the truth will come out. Cohen will make a deal & disclose your relationship too.", "20180420","0","2","","", "", "Disclose TV"
"987499022620483587","https://twitter.com/cwsimmons2812/status/987499022620483587","cwsimmons2812","How Rockefeller Found Big Pharma And Destroyed Natural Cures https://www. disclose.tv/how-rockefelle r-found-big-pharma-and-destroyed-natural-cures-331632 … via @DiscloseTV #health", "20180420","0","0","@DiscloseTV","#health", "", "Disclose TV"
"987477969437384704","https://twitter.com/C_Rodriguez_Art/status/987477969437384704","C_Rodriguez_Art","How Rockefeller Found Big Pharma And Destroyed Natural Cures https://www. disclose.tv/how-rockefelle r-found-big-pharma-and-destroyed-natural-cures-331632 … via @DiscloseTV #health", "20180420","0","0","@DiscloseTV","#health", "", "Disclose TV"
"987461950388035584","https://twitter.com/BillPeriman/status/987461950388035584","BillPeriman","North Korea Puts Nuclear Programme On Ice https://www. disclose.tv/north-korea-pu t-nuclear-programme-on-ice-331698 … via @DiscloseTV #worldnews", "20180420","3","4","@DiscloseTV","#worldnews", "", "Disclose TV"
"987455689839656960","https://twitter.com/TweetnTwatting/status/987455689839656960","TweetnTwatting","Terminator seeds sound cool...", "20180420","0","0","","", "", "Disclose TV"
"987454190980091905","https://twitter.com/disclosetv/status/987454190980091905","disclosetv","JUST IN: +++ NORTH KOREA STOPS NUCLEAR PROGRAMME +++ https://www. disclose.tv/north-korea-pu t-nuclear-programme-on-ice-331698 …", "20180420","0","4","","", "", "Disclose TV"
"987425165448482816","https://twitter.com/hohofeel/status/987425165448482816","hohofeel","How Rockefeller Found Big Pharma And Destroyed Natural Cures https://www. disclose.tv/how-rockefelle r-found-big-pharma-and-destroyed-natural-cures-331632 … via @DiscloseTV #health", "20180420","0","0","@DiscloseTV","#health", "", "Disclose TV"
"987417491470241793","https://twitter.com/GregoryJxx/status/987417491470241793","GregoryJxx","Regrann from disclosetv - http://www. disclose.tv - #regrann #yup #evolution #irony #nagging … https://www. instagram.com/p/BhzfV1XH1sU/", "20180420","0","0","","#regrann #yup #evolution #irony #nagging", "", "Disclose TV"
"987411594522124288","https://twitter.com/brainsprinkles/status/987411594522124288","brainsprinkles","Frankly, all corporate media have relationships that need disclosing--especially when it comes to matters concerning war & empire. How many war industry-employed ex-military brass go on TV pimping war, but never disclose their employers?", "20180420","0","0","","", "", "Disclose TV"
"987403397715431424","https://twitter.com/jonathanoosting/status/987403397715431424","jonathanoosting","Welfare ad is set to air on broadcast TV in GR and TC markets, starting tomorrow. Paid for by the Fund for Michigan’s Tomorrows, a nonprofit that is not required to disclose donors. https:// twitter.com/jonathanoostin g/status/987403232614993921 …", "20180420","1","1","","", "", "Disclose TV"
"987401558336909313","https://twitter.com/disclosetv/status/987401558336909313","disclosetv","What if...? https://www. disclose.tv/what-if-spacex -had-the-annual-us-military-budget-331671 …", "20180420","1","1","","", "", "Disclose TV"
"987399453446295552","https://twitter.com/apz772kman/status/987399453446295552","apz772kman","I reckon I’ve seen this bloke in one of thriller horror movies #zombies", "20180420","0","0","","#zombies", "", "Disclose TV"
"987382277108846592","https://twitter.com/Lizzycoolgurl/status/987382277108846592","Lizzycoolgurl","I don't even know y Alex had to open her mouth n disclose Dis on worldwide tv . n I prayed to God no one will bring it up cos she always feels Lyk a saint, now here it is.Its a lesson to watch how we talk. If it was Cee C dat did dis now, we will Nt hear word#bbnaija", "20180420","0","2","","#bbnaija", "", "Disclose TV"
"987379856815124481","https://twitter.com/NiceGuy504/status/987379856815124481","NiceGuy504","Diary Entries Reveal Barbara Bush Was Related To Satanist Aleister Crowley https://www. disclose.tv/diary-entries- reveal-barbara-bush-was-related-to-satanist-aleister-crowley-331623 … via @DiscloseTV #conspiracy", "20180420","0","0","@DiscloseTV","#conspiracy", "", "Disclose TV"
"987376133103550464","https://twitter.com/disclosetv/status/987376133103550464","disclosetv","They were mistakenly sent to a journalist... https://www. disclose.tv/government-acc identally-sends-remote-mind-control-file-to-journalist-331644 …", "20180420","0","2","","", "", "Disclose TV"
"987368608635351041","https://twitter.com/paul_rpaul/status/987368608635351041","paul_rpaul","Retweeted http:// Disclose.tv ( @DiscloseTV ): Did you know that the Rockefellers turned treating sick people, rather than curing them, into the hugely profitable industry it is today? https://www. disclose.tv/how-rockefelle r-found-big-pharma-and-destroyed-natural-cures-331632 …", "20180420","0","0","@DiscloseTV","", "", "Disclose TV"
"987363534559424513","https://twitter.com/disclosetv/status/987363534559424513","disclosetv","Did you know that the Rockefellers turned treating sick people, rather than curing them, into the hugely profitable industry it is today? https://www. disclose.tv/how-rockefelle r-found-big-pharma-and-destroyed-natural-cures-331632 …", "20180420","26","14","","", "", "Disclose TV"
"987358568780369922","https://twitter.com/MushroomChron/status/987358568780369922","MushroomChron","One of the highest suicide rates...", "20180420","0","1","","", "", "Disclose TV"
"987357987747614721","https://twitter.com/disclosetv/status/987357987747614721","disclosetv","Thoughts? http://www. disclose.tv pic.twitter.com/DL3Lk1qID3", "20180420","14","16","","", "", "Disclose TV"
"987349228593864705","https://twitter.com/Hypodemicnerdal/status/987349228593864705","Hypodemicnerdal","No", "20180420","0","0","","", "", "Disclose TV"
"987344404204720128","https://twitter.com/Pussilicca/status/987344404204720128","Pussilicca","Skywatcher Was Able To Spot And Document A Spectacular Flying Saucer Visible In Broad Daylight | http:// Disclose.tv https://www. disclose.tv/skywatcher-was -able-to-spot-and-document-a-spectacular-flying-saucer-visible-in-broad-daylight-331434?utm_source=newsletter&utm_medium=mail&utm_campaign=disclose_daily_04_19_2018 … via @DiscloseTV #ufos", "20180420","0","0","@DiscloseTV","#ufos", "", "Disclose TV"
"987309942561533952","https://twitter.com/disclosetv/status/987309942561533952","disclosetv","http://www. disclose.tv pic.twitter.com/zg5FA0OCIx", "20180420","8","10","","", "", "Disclose TV"
"987300920785620993","https://twitter.com/shahstarter/status/987300920785620993","shahstarter","Did Russia Try To Kill An Invincible 18 Feet Tall Alien With It's Biggest Nuclear Bomb? | http:// Disclose.tv https://www. disclose.tv/did-russia-try -to-kill-an-invincible-18-feet-tall-alien-with-its-biggest-nuclear-bomb-331410 … by @DiscloseTV", "20180420","0","0","@DiscloseTV","", "", "Disclose TV"
"987300724219539459","https://twitter.com/UFOINVA51ON/status/987300724219539459","UFOINVA51ON","Major UFO Encounters ! https://www. disclose.tv/major-ufo-enco unters-331557 … via @DiscloseTV #ufos", "20180420","0","0","@DiscloseTV","#ufos", "", "Disclose TV"
"987297520715026433","https://twitter.com/TheBestEvidence/status/987297520715026433","TheBestEvidence","After 20+ years of drinking the stuff, I decided to quit a little over a week ago. NEVER GOING BACK!", "20180420","0","0","","", "", "Disclose TV"
"987288289643302913","https://twitter.com/disclosetv/status/987288289643302913","disclosetv","The end of diet soda? https://www. disclose.tv/huge-study-lin ks-aspartame-to-major-health-problems-331521 …", "20180420","16","19","","", "", "Disclose TV"
"987136047111782400","https://twitter.com/PrinceKaguyo/status/987136047111782400","PrinceKaguyo","We are already in full Apocalypse and many things has been already fulfilled Apocalypse mean revelation, not destruction....", "20180419","0","0","","", "", "Disclose TV"
"987128151305277441","https://twitter.com/irby196969/status/987128151305277441","irby196969","'Demon Eye' Transition Contact Lenses Were Just FDA Approved (DEMO VIDEO) https://www. disclose.tv/demon-eye-tran sition-contact-lenses-were-just-fda-approved-demo-video-331413 … via @DiscloseTV #paranormal", "20180419","0","0","@DiscloseTV","#paranormal", "", "Disclose TV"
"987126835497619458","https://twitter.com/irby196969/status/987126835497619458","irby196969","The Police Uses This Machine To Extract All Your Smartphone Data https://www. disclose.tv/the-police-use s-this-machine-to-extract-all-your-smartphone-data-331458?utm_source=Facebook&utm_medium=newsbot … via @DiscloseTV #activism", "20180419","0","0","@DiscloseTV","#activism", "", "Disclose TV"
"987117379942535168","https://twitter.com/irby196969/status/987117379942535168","irby196969","Jesus Told Priest These 12 Signs About The End Of The World https://www. disclose.tv/jesus-told-pri est-these-12-signs-about-the-end-of-the-world-331506?utm_source=Facebook&utm_medium=newsbot … via @DiscloseTV #prophecy", "20180419","0","0","@DiscloseTV","#prophecy", "", "Disclose TV"
"987090508219670531","https://twitter.com/TheWisemanSaid2/status/987090508219670531","TheWisemanSaid2","Who cares? People who respect honesty and integrity. If you are a TV show host, and you have an opinion about someone - it's appropriate to disclose your personal relationship with that individual. It's a matter of bias.", "20180419","0","0","","", "", "Disclose TV"
"987090211657175040","https://twitter.com/disclosetv/status/987090211657175040","disclosetv","One of the best closeups we've ever seen of this strange Moon anomaly: https://www. disclose.tv/gigantic-spire -filmed-on-the-moon-331563 …", "20180419","2","0","","", "", "Disclose TV"
"987086615272218624","https://twitter.com/jaypeze82_john/status/987086615272218624","jaypeze82_john","Shell Oil Scientist Admits Breaking 1,000 Miles Per Gallon In 70s | http:// Disclose.tv https://www. disclose.tv/shell-oil-scie ntist-admits-breaking-1000-mpg-in-70s-331494#commentform … via @DiscloseTV #conspiracy", "20180419","0","0","@DiscloseTV","#commentform #conspiracy", "", "Disclose TV"
"987072962888130560","https://twitter.com/NiceGuy504/status/987072962888130560","NiceGuy504","The Police Uses This Machine To Extract All Your Smartphone Data https://www. disclose.tv/the-police-use s-this-machine-to-extract-all-your-smartphone-data-331458 … via @DiscloseTV #activism", "20180419","0","0","@DiscloseTV","#activism", "", "Disclose TV"
"987072779806687232","https://twitter.com/hapawriter/status/987072779806687232","hapawriter","Great....ha ha ha....Think Brett Haase has one like that about people killing each other over who has the better imaginary friend.", "20180419","0","0","","", "", "Disclose TV"
"987051114997612545","https://twitter.com/IWingdogie/status/987051114997612545","IWingdogie","Did Russia Try To Kill An Invincible 18 Feet Tall Alien With It's Biggest Nuclear Bomb? https://www. disclose.tv/did-russia-try -to-kill-an-invincible-18-feet-tall-alien-with-its-biggest-nuclear-bomb-331410 … via @DiscloseTV #aliens", "20180419","0","0","@DiscloseTV","#aliens", "", "Disclose TV"
"987048808017252352","https://twitter.com/barrysellers/status/987048808017252352","barrysellers","What I said was that most tv talking heads, journalists or not, have relationships with some people that they talk with or about. They do not disclose that everytime that they do. Maybe they should? I don’t know. I used to hear them say as much. Like Donna at Fox 16 did recently.", "20180419","0","0","","", "", "Disclose TV"
"987037290324201472","https://twitter.com/AnnKaldg/status/987037290324201472","AnnKaldg","Since I'll go to jail,last thing on bucket list", "20180419","0","0","","", "", "Disclose TV"
"987034928868028416","https://twitter.com/_N0kturnal/status/987034928868028416","_N0kturnal","we can do it easy remember that one time me u and black climbed to the top of ur apt. building drunk lmao we have experience already lmao my bad again about that lol!!", "20180419","0","0","","", "", "Disclose TV"
"987034369490468864","https://twitter.com/_BLER138/status/987034369490468864","_BLER138","Imagine doing this my dude???", "20180419","0","1","","", "", "Disclose TV"
"987031354880733184","https://twitter.com/disclosetv/status/987031354880733184","disclosetv","An 18-year-old illegally climbed Egypt's Great Pyramid in broad daylight: https://www. disclose.tv/forbidden-imag es-from-atop-egypts-great-pyramid-323556 …", "20180419","5","12","","", "", "Disclose TV"
"987021140676800512","https://twitter.com/Adepiero57/status/987021140676800512","Adepiero57","The criminals will come on Tv to disclose a different price but will charge another in their office. And you might have to tip them to get your passport early. https:// twitter.com/cute_pecky/sta tus/987020092797063168 …", "20180419","2","1","","", "", "Disclose TV"
"987018705136685056","https://twitter.com/PotsoKgwale/status/987018705136685056","PotsoKgwale","@ratiie_", "20180419","0","0","@ratiie_","", "", "Disclose TV"
"987016931638063104","https://twitter.com/thegrantdoctors/status/987016931638063104","thegrantdoctors","Indeed. Anyone appearing in the media ( TV , radio, print, online) as a host or a guest should be required to disclose any/all political or campaign involvement in addition to their spouse & relatives. Let’s get everything in the open. https:// twitter.com/cherijacobus/s tatus/986789212723798016 …", "20180419","0","0","","", "", "Disclose TV"
"987015177076989952","https://twitter.com/2wheelninja500/status/987015177076989952","2wheelninja500","pic.twitter.com/v2gWUU7TtJ", "20180419","0","0","","", "", "Disclose TV"
"987013723108802560","https://twitter.com/disclosetv/status/987013723108802560","disclosetv","12 messages about when the Apocalypse will arrive... https://www. disclose.tv/jesus-told-pri est-these-12-signs-about-the-end-of-the-world-331506 …", "20180419","7","8","","", "", "Disclose TV"
"987010271481868289","https://twitter.com/hofstetter_mary/status/987010271481868289","hofstetter_mary","'Demon Eye' Transition Contact Lenses Were Just FDA Approved (DEMO VIDEO) https://www. disclose.tv/demon-eye-tran sition-contact-lenses-were-just-fda-approved-demo-video-331413?utm_source=newsletter&utm_medium=mail&utm_campaign=disclose_daily_04_19_2018 … via @DiscloseTV #paranormal", "20180419","0","0","@DiscloseTV","#paranormal", "", "Disclose TV"
"987008050807623684","https://twitter.com/annalecta/status/987008050807623684","annalecta","Maryland's legislature recently passed another transparency bill requiring social media platforms to track political ad data & publicly disclose spending similar to TV ad disclosure rules—but it has not yet been signed into law by @GovLarryHogan . http:// bsun.md/2GEy0An", "20180419","4","6","@GovLarryHogan","", "", "Disclose TV"
"987004545942237184","https://twitter.com/gordonrfriedman/status/987004545942237184","gordonrfriedman","Of course. I’m not saying there’s a hard and fast rule to be followed. Just pointing out that TV newsrooms often don’t disclose who the reporter is and I think that’s odd, even for press release rewrites.", "20180419","0","1","","", "", "Disclose TV"
"987001127341346823","https://twitter.com/disclosetv/status/987001127341346823","disclosetv","This video connects the dots on the Sumerians, the Greek Gods and the origin of mankind: https://www. disclose.tv/the-true-origi n-of-mankind-and-the-roots-of-ancient-human-civilization-331509 …", "20180419","2","5","","", "", "Disclose TV"
"986995593506586625","https://twitter.com/disclosetv/status/986995593506586625","disclosetv","Shell Oil scientists figured out how to get over 1,000 miles per gallon (mpg) in the late 1970s! https://www. disclose.tv/shell-oil-scie ntist-admits-breaking-1000-mpg-in-70s-331494 …", "20180419","17","11","","", "", "Disclose TV"
"986982797876187138","https://twitter.com/Sportsbet01/status/986982797876187138","Sportsbet01","Temporary worker for them years ago. Absolutely true about this. Fuck Amazon.", "20180419","0","0","","", "", "Disclose TV"
"986969890346192897","https://twitter.com/tregas/status/986969890346192897","tregas","Is this argument about whether or not the Federalist has to open their books. or a tv talking head / opinion journalist (whatever that is) / needs to disclose a close personal relationship with a person or thing they are advocating for?", "20180419","0","1","","", "", "Disclose TV"
"986950057097342977","https://twitter.com/MattoTheMacko/status/986950057097342977","MattoTheMacko","Someone needs to put down the acid and do some proof reading", "20180419","0","0","","", "", "Disclose TV"
"986949155997274113","https://twitter.com/codedtestament1/status/986949155997274113","codedtestament1","Amazon Employees Pee In Bottles For Fear Of Getting Trouble For Taking Breaks https://www. disclose.tv/amazon-employe es-pee-in-bottles-for-fear-of-getting-trouble-for-taking-bathroom-breaks-331386 … via @DiscloseTV #society", "20180419","0","0","@DiscloseTV","#society", "", "Disclose TV"
"986948620548280320","https://twitter.com/Richiestoke/status/986948620548280320","Richiestoke","It's dad is looking for it.", "20180419","0","0","","", "", "Disclose TV"
"986947546701549569","https://twitter.com/disclosetv/status/986947546701549569","disclosetv","In an account told in a top secret document which reads like a Stephen King thriller, an alien evolved rapidly in a Russian underground facility after its capture. https://www. disclose.tv/did-russia-try -to-kill-an-invincible-18-feet-tall-alien-with-its-biggest-nuclear-bomb-331410 …", "20180419","6","12","","", "", "Disclose TV"
"986947518381608960","https://twitter.com/CharlesEGwynn1/status/986947518381608960","CharlesEGwynn1","US Troops Secretly Amassing On Syria’s Border! World War 3 Next? https://www. disclose.tv/us-troops-secr etly-amassing-on-syrias-border-world-war-3-next-331461 … via @DiscloseTV #worldnews", "20180419","0","1","@DiscloseTV","#worldnews", "", "Disclose TV"
"986946587854360576","https://twitter.com/thelee_x_w/status/986946587854360576","thelee_x_w","Seems a good idea to have people whose specialities match the role in the cabinet. However 50% women smacks of being to pc to me best man or woman for the job I say", "20180419","0","0","","", "", "Disclose TV"
"986937357944340481","https://twitter.com/chameleonsuk/status/986937357944340481","chameleonsuk","Did Russia Try To Kill An Invincible 18 Feet Tall Alien With It's Biggest Nuclear Bomb? https://www. disclose.tv/did-russia-try -to-kill-an-invincible-18-feet-tall-alien-with-its-biggest-nuclear-bomb-331410 … via @DiscloseTV #aliens", "20180419","1","1","@DiscloseTV","#aliens", "", "Disclose TV"
"986931514410749952","https://twitter.com/magsmills/status/986931514410749952","magsmills","Hemp Could Change The World But It's Suppressed By Powerful Corporations https://www. disclose.tv/hemp-could-sav e-the-world-but-its-suppressed-by-powerful-corporations-331389?utm_source=newsletter&utm_medium=mail&utm_campaign=disclose_daily_04_19_2018 … via @DiscloseTV #conspiracy", "20180419","0","0","@DiscloseTV","#conspiracy", "", "Disclose TV"
"986929423348830208","https://twitter.com/HelalKanza/status/986929423348830208","HelalKanza","Disclose ur tv project", "20180419","0","5","","", "", "Disclose TV"
"986929258294579200","https://twitter.com/clearwestcrew/status/986929258294579200","clearwestcrew","Hemp Could Change The World But It's Suppressed By Powerful Corporations | http:// Disclose.tv https://www. disclose.tv/hemp-could-sav e-the-world-but-its-suppressed-by-powerful-corporations-331389?utm_source=newsletter&utm_medium=mail&utm_campaign=disclose_daily_04_19_2018 … via @DiscloseTV #conspiracy", "20180419","0","0","@DiscloseTV","#conspiracy", "", "Disclose TV"
"986925886896295936","https://twitter.com/disclosetv/status/986925886896295936","disclosetv","Thoughts? http://www. disclose.tv pic.twitter.com/yqYCX3g99t", "20180419","19","32","","", "", "Disclose TV"
"986918717450842114","https://twitter.com/swasim9/status/986918717450842114","swasim9","Life is all about state of mind, you get what you dream, you live life what you want to live, think to live. Please read #theSecret written by #rhondabyrne", "20180419","0","2","","#theSecret #rhondabyrne", "", "Disclose TV"
"986917428872478721","https://twitter.com/swasim9/status/986917428872478721","swasim9","The all rules made by all sir's of your ideologies. What the almighty rules, i already share with you.", "20180419","0","0","","", "", "Disclose TV"
"986916972108673024","https://twitter.com/swasim9/status/986916972108673024","swasim9","Sir I understand why you know what's the Satan thought, I only knew what almighty word's and it's all about mercy & forgiveness.", "20180419","0","0","","", "", "Disclose TV"
"986819011483766784","https://twitter.com/akogunjah/status/986819011483766784","akogunjah","You're a fool! Media didnt disclose him as the client, HIS LAWYER FRIEND DID! well, i believe cohen over hannity that had lied numerous times on national tv ! You're ridiculiusly stupid!", "20180419","0","0","","", "", "Disclose TV"
"986817578470260736","https://twitter.com/rgibbs33/status/986817578470260736","rgibbs33","Because from time to time, Hannity has called himself a journalist (this piece does a good job of laying out his comments on the subject): https://www. google.com/amp/s/www.wash ingtonpost.com/amphtml/news/the-fix/wp/2017/11/29/sean-hannity-now-claims-to-be-a-journalist-he-should-be-judged-as-such/ … Regardless, it’s unethical not to disclose that you’re a client of the guy you’re defending on your huge TV show.", "20180419","0","0","","", "", "Disclose TV"
"986813924489203713","https://twitter.com/fortycats/status/986813924489203713","fortycats","Project Blue Beam: NASA Is Beta Testing Alien Invasion | http:// Disclose.tv https://www. disclose.tv/project-blue-b eam-nasa-is-beta-testing-alien-invasion-314751 … via @DiscloseTV #aliens", "20180418","0","0","@DiscloseTV","#aliens", "", "Disclose TV"
"986810002005544960","https://twitter.com/bigfeet5551/status/986810002005544960","bigfeet5551","SpaceX To Launch NASA's Alien Hunting Telescope 'TESS' This Evening! https://www. disclose.tv/spacex-to-laun ch-nasas-alien-hunting-telescope-tess-this-evening-331178 … via @DiscloseTV #space", "20180418","0","0","@DiscloseTV","#space", "", "Disclose TV"
